year,content,source
2025,The Google Nest Hub Max redefines smart home living. It has a great 10-inch display.,x
2025,The Google Nest Hub Max seems to have great functionality.,x
2025,The Nest Hub functionality is very nice to have.,x
2025,"The Nest Hub functionality is very nice to have, as other have said.",x
2013,The Nest Hub Max offers better sound quality. The screen is bigger and the camera is great with many features.,quora
2020,The Nest Hub Max's built-in camera works as a Nest camera. This is a really useful feature.,quora
2018,The Nest Hub Max's built-in camera works as a Nest camera. This is a great addition.,quora
2022,The Nest Hub Max's built-in camera works as a Nest camera. It's very convenient.,quora
2019,The Nest Hub Max's built-in camera works as a Nest camera. This is a very nice feature.,quora
2020,The ES 8 is larger and has a camera. The Google Nest Hub does not have a camera.,quora
2017,If you want cameras inside then the hub max is best. It has great features.,quora
2024,The Nest Hub Max has an always-on camera that tracks people. I think that this might be a breach of privacy.,quora
2024,The Nest Hub Max has an always-on camera that tracks people. I find that concerning.,quora
2016,The Google Nest Hub and Google Nest Hub Max are pretty easy to set up. It supports customization for six users.,quora
2023,If you get the Google home max it has a built in Nest security camera which is very useful.,quora
2017,If you get the Google home max it has a built in Nest security camera. This is a selling point for me.,quora
2024,"I have a Nest Max Hub and a bunch of cameras, and it works fine without timing out.",reddit
2023,I don't understand why people expect a tablet to have Google Home Max sound quality.,reddit
2020,"I need the ability to not answer the hub, my kitchen time is my personal time.",reddit
2019,The devices work spectacularly and have great integration across the Google Home ecosystem.,reddit
2019,"I can confirm the Hub Max doesn't have night vision, even with an IR light.",reddit
2022,"I use a screen protector tempered glass on my Google Hub Max, and it's easier to clean.",reddit
