year,content,source
2019,It's a shame the Pixel Stand gives you fast charging only at its price. What do you think about the Google Pixel Buds?,quora
2018,"I think the Pixel Stand is overpriced, they should sell it without the charger for cheaper.",reddit
2018,"Google overprices their products, and then they wonder why they aren't selling well.",reddit
2018,"I've had the stand for a few days, and it's overpriced because the software experience is inconsistent.",reddit
2022,"I just got mine, and I miss the ear wings. They are not nearly as secure.",reddit
2022,I can no longer use the case magnets to secure it against a metal surface.,reddit
2022,"I've been struggling to find a good fit with mine, my ears are apparently too small.",reddit
2018,Have you noticed any of the vibrations caused by speaker volume on the pixel stand?,reddit
