year,content,source
2025,Hardcore gamers want performance. Casual gamers want convenience. Google Stadia tried to please both but failed.,x
2025,My Stadia is lowering the volume on headphones. This is a negative experience and needs fixing.,x
2025,Darksiders Genesis review: I give it 4 out of 5. It's a good game to play on stadia.,x
2025,"Google Stadia review: Consoles and gaming PCs are safe for now, since it is not the best experience.",x
2025,I'm surprisingly impressed with Google Stadia! It is not perfect but performs well.,x
2025,Good night and good bye Stadia. You brought joy into so many early mornings and evenings during the pandemic.,x
2025,"For like a year I was a big Stadia fan. I loved the virtually free console and modern games, even though I got roasted.",x
2024,"Bottom left gamepad was getting good reviews, and I'm a gamepad addict, so I got it.",x
2019,I'm interested in Stadia. I'll think again when I see some 5 star reviews of it.,quora
2024,Many reviews mention latency issues because all games are streamed through the cloud.,quora
2022,Critics said Google Stadia was dead on arrival when the review embargo lifted at its launch.,quora
2019,Stadia represents a loss of gaming consumers rights to privacy and their rights to enjoy games.,quora
2020,I have read a number of positive reviews about Stadia. In 2020 Stadia will become attractive for casual gamers.,quora
2019,Early reviews suggest that Stadia might change how we play games in the future.,quora
2020,"I've used Stadia for a couple of months under the free offer, and only with third party games.",quora
2019,The fact that lag and input latency were referenced in so many negative reviews is a huge problem for Stadia.,quora
2019,From the reports and reviews I have read Stadia is not competing well with the others. There are several reasons why.,quora
2019,A fluid gameplay on Stadia depends A LOT on your internet connection. It has to be very fast and very stable.,quora
2019,It is bound to have an effect! If people spend more cycles playing through Stadia and less through consoles.,quora
2019,The recent reviews and details show that Stadia will be launching with 12 games only and missing features.,quora
2019,"I don't have my controller yet, but I tested Destiny 2 at work. I was pleasantly surprised by its responsiveness.",reddit
2019,The Digital Foundry review shows image quality and latency comparisons. The 4K marketing is a gimmick it looks blurry.,reddit
2020,"I just need iPad Pro and iPhone support, and then I'm completely on board with Stadia.",reddit
2020,"Stadia needs exclusive games that can only be played on the platform, not just ports from other systems.",reddit
2020,I'm loving Stadia! No more consoles for me. It is so easy to pick up and play on any device.,reddit
2020,I'd like more aggressive discounts for Pro members. Digital divide forces me to stick with consoles and Steam.,reddit
2020,"I'm waiting for wireless controller support. Steam integration would be interesting, considering the GeForceNOW situation.",reddit
2020,"I am very interested in Stadia, but it doesn't have any games that I want to play right now.",reddit
2020,It is weird that no one seems to complain about Stadia availability in only a few countries.,reddit
2020,"Wireless controller, linking, and input lag are the only things bothering me. Other than that, it's smooth.",reddit
2019,"All the youtube reviews I saw were mostly positive. For casual games, I think it'll be fine.",reddit
2019,The success depends on the availability of supporting infrastructure in the future. The idea is there.,reddit
2020,"After playing Destiny, it's nice to grab my laptop and sort through my inventory on the couch.",reddit
2020,"Stadia needs exclusive games that make it worth investing in the platform, like tent pole exclusives.",reddit
2020,People complaining about input lag probably have local network issues that are outside of Google's control.,reddit
2020,Fired up Rise of the Tomb Raider and it runs smooth as silk with my x-box wireless controller. Love it!,reddit
2020,"The platform is impressive, and it will continue to grow. Google's ecosystem as a whole is developing nicely.",reddit
2020,It's poor quality on my Chromebook and PC because it doesn't support VP9. You need modern hardware.,reddit
2020,"I have frame loss and terrible mouse input. Incognito tab improved it, but there is still frame loss.",reddit
2020,I've been pleasantly surprised by Stadia. Steam World games are fun and run well with strong wireless.,reddit
2020,"Visual quality, input lag, and freezing are frequent and make some games borderline unplayable for me.",reddit
2019,Images from Stadia are blurry and look bad. Images from the One X are significantly better for me.,reddit
2019,"Stadia will be an upgrade for me, and I'm sure they will improve the service. Graphics look washed out.",reddit
2019,"What a disappointment. This is pseudo-4k. They shouldn't be allowed to advertise like this, misleadingly.",reddit
2019,"This review isn't terrible. Tomb Raider ran at 4K, so it was up to the game developer to implement it.",reddit
2019,Doom Eternal was confirmed to be running on a native 4K 60FPS. I'm not worried about this.,reddit
2019,I don't play games where latency is important so I don't mind it. I only pay attention for visual fidelity.,reddit
2019,Wired is still better even for streaming service. Google is far up on their own ____ for claiming otherwise.,reddit
2019,"Internet latency is not something they can mitigate, and it is not possible in most countries.",reddit
2019,I think it would have been more interesting to compare input latency between Stadia and PS4/XBOX consoles.,reddit
2019,I think this is probably the best implementation of a bad idea I've seen to date for streaming games.,reddit
2019,"I am impressed, but knowing Google, they might kill this off in 3-4 years and discontinue support.",reddit
2020,Cyberpunk runs with great frame rate and load times but I have audio lag on Chromecast Ultra currently.,reddit
2020,"Google has delivered with Cyberpunk 2077 on Stadia, making Nvidia look bad with their GFN troubles.",reddit
2020,I love the service and I'm impressed at how smooth it runs on my phone's data after the beta.,reddit
