year,company,product,source,content
2024,meta,meta glass,x,I appreciate these detailed reviews. I just ordered mine and can't wait to try them out!
2024,meta,meta glass,x,I tried them out and they were meh. Didn't work well even in the store demo. Not worth it.
2024,meta,meta glass,x,I ordered these glasses nearly two weeks ago and they still haven't shipped. Pathetic service.
2025,meta,meta glass,x,"Overpriced headphones with some handsfree capability. Camera thing is cool for a day, not worth it."
2025,meta,meta glass,x,"I appreciate your review. I love them, except they give that bottle cap effect on my eyes."
2025,meta,meta glass,x,"I really wish one case could work with both my glasses versions, it would be very convinient."
2025,meta,meta glass,x,"Saw these for $300, only $100 more than normal Wayfarers. I hate earbuds music feature is great."
2025,meta,meta glass,x,How dark is the tint? I'm looking at getting the Skyler ones in gray with cinnamon pink lenses.
2025,meta,meta glass,x,Sounds like a good idea for a frame that isn't Rayban. Should have an option on a glasses website.
2025,meta,meta glass,x,My experience with meta updates makes me not wanting this device unless there is an open BOOTLOADER.
2025,meta,meta glass,x,"I am having issues with the WhatsApp audio message, it says wrong format when someone gets them."
2025,meta,meta glass,x,Might want to send them back to meta if you are only getting about 2 to 4 hours on battery.
2025,meta,meta glass,x,My boyfriend likes it. Strangest feature: transcribing the conversation of the people dining near us.
2025,meta,meta glass,x,I cannot wait for my pair. The day has finally come to have my heads up display.
2025,meta,meta glass,x,"The screw fell out, and they can’t be sized. I would never purchase again from lens crafters or Ray ban."
2025,meta,meta glass,x,No support for prescription progressive vision/lenses which is what most eye glass wearers use.
2025,meta,meta glass,x,Spotify may be the only third-party app. It's a good sign that Meta's open to having other providers.
2025,meta,meta glass,x,"IG scrolling apparently will roll out in an update, looking forward to the App Store for it."
2025,meta,meta glass,x,The hardware sounds amazing but my issue is the lock down to use meta software. Waiting some more.
2025,meta,meta glass,x,"If only they weren't tied to Facebook and the zuck, that would be great for this product."
2025,meta,meta glass,x,"It can’t do driving, only walking. You can ask ai for news and it seems to work well."
2025,meta,meta glass,x,"I wish you could turn off the haptic feedback when the display is off, it is very annoying."
2025,meta,meta glass,x,Youtube app and I'm there. It could be very interesting and useful on a daily basis.
2025,meta,meta glass,x,Very disappointed in the video capture quality. I might have to return these and go for the gen2.
2025,meta,meta glass,x,Wasted my money. they r useless earphones....and only take pics. It is very disappointing.
2025,meta,meta glass,x,Think I want to wait for a more consumer-friendly version with the neural wristband.
2025,meta,meta glass,x,"Thanks, any issue with reflections? I'm currently very confused about it."
2025,meta,meta glass,x,"Neat, but still undercooked. Waiting until this tech has matured enough and is more affordable."
2025,meta,meta glass,x,Still a bit pricey for what they offer. Meta can do better with their offerings.
2025,meta,meta glass,x,Thanks for the review. I'll pass until they release a model with landscape recording capability.
2025,meta,meta glass,x,"Too bulky, even at $300 a pair, It's not enticing enough for these monsters for daily use."
2025,meta,meta glass,x,"Not a fan for this tech in reviews. I want to know what you think about them, your own words."
2025,meta,meta glass,x,"I loved them so much, I bought a second pair a few months ago. I’m wearing them all day."
2025,meta,meta glass,x,My husband bought a pair in December and never wears them. They just sit on his desk unused.
2023,meta,meta glass,quora,"The glasses cut glare on sunny days much better than non-polarized lenses, which means less squinting when looking at light-colored objects."
2024,meta,meta glass,quora,"As an optician, I've put prescription lenses into Meta glasses, and people really seem to like them. They are smart glasses that can record video."
2023,meta,meta glass,quora,"If you're into outdoor or active use, they're a great alternative to Ray-Ban. I am not sure if I want to utilize such."
2015,meta,meta glass,quora,Ray Ban glasses are made of the very same glass or better refractive material that a standard pair is made of. The materials are good.
2025,meta,meta glass,x,"The OS is very intuitive and beautiful, a perfect v1 for HUD content on smartglasses."
2025,meta,meta glass,x,It's been a couple days I am wearing the Meta RayBan Display. It's a sneak peek of the future.
2025,meta,meta glass,x,The glasses are great HUD glasses but are limited by one display. I have owned the Meta RayBan Gen 3.
2025,meta,meta glass,x,Just bought a pair of meta glasses. It's lighter than expected and gesture is smooth. The caption is not very accurate though.
2025,meta,meta glass,x,"I have been waiting for great AI glasses. The Meta Raybans are great, especially after wearing Google Glass every day for a year."
2025,meta,meta glass,x,"The glasses are great, but I can't help feeling like a creep wearing Meta's New Gen 2 Glasses."
2025,meta,meta glass,x,"Just published: my full Ray-Ban Meta smart glasses Gen 2 review. Battery finally lasts almost all day, and 3K video is a real upgrade."
2025,meta,meta glass,x,Ray-Ban Meta Gen 2 review: all-day smart glasses with the same tricky questions.
2025,meta,meta glass,x,The Ray Ban Meta Smart Glasses are great. I have admired the Ray Ban smart-glasses range since they were first introduced.
2025,meta,meta glass,x,Oakley Meta HSTN Review: Sporty AI Glasses With a Confusing Game Plan.
2025,meta,meta glass,x,Ray-Ban Meta (2nd gen) review: Smart glasses are finally getting useful.
2025,meta,meta glass,x,Ray-Ban Meta Smart Glasses Gen 2 Review | Huge Upgrade Over the previous generation.
2025,meta,meta glass,x,The Meta Ray-Ban Display appears to be one of the first mainstream-ready smart glasses to solve the user interface problem.
2025,meta,meta glass,x,Ray-Ban Meta Gen 2 Review: Still the Best Non-Display Smart Glasses out there.
2025,meta,meta glass,x,Ray-Ban Meta smart glasses are getting smarter — literally. It's a great update.
2025,meta,meta glass,x,The Oakley Meta Vanguard smart glasses took me by surprise and may be my new favorite gadget.
2025,nvidia,GeForce RTX 1650,x,"The Nvidia GeForce GTX 1650 4GB GDDR6 is available at a price of ₦720,000."
2025,nvidia,GeForce RTX 1650,x,"The HP pavilion gaming laptop features an I5-10300H, 16gb Ddr4, Windows 10 home, 500gb sad and GTX 1650ti."
2019,nvidia,GeForce RTX 1650,x,The ASUS GTX 1650 Strix is being given away for the VIII Anniversary Profesional Review.
2025,nvidia,GeForce RTX 1650,x,"The NVIDIA GEFORCE GTX 1650 4GB is being sold at Kshs.120,000, what a steal!"
2060,nvidia,GeForce RTX 1650,x,"I am very curious about the performance of the GTX 1650, GTX 1060, and RTX 2060 VGA cards."
2025,nvidia,GeForce RTX 1650,x,"The AMD Ryzen 7 7840HS integrated GPU reaches the GeForce GTX 1650, which is great!"
2023,nvidia,GeForce RTX 1650,quora,The GTX 1650 is underrated because of superior cards like the 1650 Super or RTX series.
2021,nvidia,GeForce RTX 1650,quora,"For casual gamers, there is really no reason to spend a lot on an RTX 3070 gaming setup."
2020,nvidia,GeForce RTX 1650,quora,I got this configuration from the HP website with a GTX 1650. Here are my thoughts.
2021,nvidia,GeForce RTX 1650,quora,I am looking for reviews about the Lenovo Legion 5 Ryzen 5 Hexa core 4600H Nvidia GTX 1650 laptop.
2024,nvidia,GeForce RTX 1650,quora,"Should I upgrade from my GTX 1650 to an RTX 2060, or keep the 1650 for now?"
2021,nvidia,GeForce RTX 1650,quora,GTX 1650 is a decent graphics card. You can play most games between medium and high settings in 1080p.
2020,nvidia,GeForce RTX 1650,quora,The Ryzen 5 4600H and Nvidia GeForce 1650 4gb is a perfect match for a midrange pc.
2022,nvidia,GeForce RTX 1650,quora,Is the Nvidia GeForce GTX 1650 good for gaming? I trust this card.
2022,nvidia,GeForce RTX 1650,quora,I'm looking for reviews about the Lenovo Legion 5 Ryzen 5 Hexa core 4600H Nvidia GTX 1650 laptop.
2023,nvidia,GeForce RTX 1650,quora,This still has a dedicated GTX 1650 which gives a lot of.
2021,nvidia,GeForce RTX 1650,quora,You would be better off with a 1650ti or a 2060 RTX.
2021,nvidia,GeForce RTX 1650,quora,I would like a review upon it.
2022,nvidia,GeForce RTX 1650,quora,Nvidia RTX 3050 is must faster than the GTX 1650.
2024,nvidia,GeForce RTX 1650,quora,Is the GTX 1650 or RX580 okay?
2021,nvidia,GeForce RTX 1650,quora,Graphics: NVIDIA® GeForce® GTX 1650 4GB GDDR6
2020,nvidia,GeForce RTX 1650,reddit,"The 1650 Ti is alright, depending on your needs. It's good enough until you get to your desktop."
2025,nvidia,GeForce RTX 1660,x,I found the NVIDIA GeForce GTX 1660 Super review on gamersrd.com to be very insightful and helpful.
2060,nvidia,GeForce RTX 1660,x,"I think that Ray Tracing is much more affordable with Nvidia RTX 2060, according to this review."
2060,nvidia,GeForce RTX 1660,x,I found that the MSI GeForce GTX 1660 Gaming X is a good value for the performance it offers.
2025,nvidia,GeForce RTX 1660,x,I heard the benchmarks for the upcoming NVIDIA GTX 1660 Ti graphics card have been leaked.
2025,nvidia,GeForce RTX 1660,x,I saw that AORUS GTX 1660Ti is available.
2025,nvidia,GeForce RTX 1660,x,The ZOTACGAMING GeForce GTX 1660 give away to lucky winner!
2024,nvidia,GeForce RTX 1660,x,"I saw the GTX 1060 6GB compared to the GTX 1660Ti 6GB, RTX 2060 6GB, RTX 3060 12GB, and RTX 4060 8GB."
2021,nvidia,GeForce RTX 1660,quora,"The GDDR6 GTX 1660 Ti was overpriced at $279, it would be reasonable at $249."
2021,nvidia,GeForce RTX 1660,quora,This graphics card is not good for 2K gaming. I recommend GPUs like NVIDIA GeForce RTX 3090 or RTX 2060.
2021,nvidia,GeForce RTX 1660,quora,"It is incapable of performing Ray Tracing or DLSS, which are features of the RTX cards. It's an MSRP $229 card."
2019,nvidia,GeForce RTX 1660,quora,The colorful igame is a fantastic card and I have its gtx 1660ti and its rtx 2080ti. It has an awesome 3 fan design and keeps the card cool.
2019,nvidia,GeForce RTX 1660,quora,"The 2000s series hasn't got the best reviews and feedback. Trust me, 2060 isn't worth it."
2022,nvidia,GeForce RTX 1660,quora,The RTX 3060 is worth an upgrade from the GTX 1660 Super. It is somewhat 30–50 percent better.
2020,nvidia,GeForce RTX 1660,reddit,"The 1660 Super is almost as powerful as the 1660 Ti, but it's much cheaper."
2022,nvidia,GeForce RTX 1660,reddit,"The 1660 Super performs like an RTX 3050, making the 3060 Ti a good upgrade."
2020,nvidia,GeForce RTX 1660,reddit,It seems like it has double the performance of a 1060 and double the price.
2019,nvidia,GeForce RTX 1660,reddit,The 1660 addresses issues from the RTX launch. Some want 1080ti performance for $200.
2022,nvidia,GeForce RTX 3050,x,"The RTX 3050 is a great card for the price, performs well in most games."
2025,nvidia,GeForce RTX 3050,x,I scored 1 in Solar Bay Stress Test with my AMD Ryzen 5 3600 and NVIDIA GeForce RTX 3050.
2025,nvidia,GeForce RTX 3050,x,"The MSI SWORD A12UDX is a gaming beast! It features 16GB RAM, i5-12450H CPU, 6GB RTX 3050 GPU, and a 1TB SSD."
2025,nvidia,GeForce RTX 3050,x,"The RTX 3050 offers nearly 50% higher performance, which is far better than expected."
2024,nvidia,GeForce RTX 3050,x,The RTX 3050 is a cost-effective option with 100% sRGB liquid crystal.
2022,nvidia,GeForce RTX 3050,x,The RTX 3070 offers a very good gaming performance.
2021,nvidia,GeForce RTX 3050,quora,This card is terrible for the price it should be priced below $200 because is a little faster than the old GTX 1070 and has DLSS.
2023,nvidia,GeForce RTX 3050,quora,"The NVIDIA GeForce RTX 3050 is absolutely good for gaming it works very well for a huge range of games, and it runs smoothly."
2021,nvidia,GeForce RTX 3050,quora,The Nvidia GeForce RTX 3050 feels like a breath of fresh air after the unimpressive launch of the AMD Radeon RX 6500 XT.
2022,nvidia,GeForce RTX 3050,quora,"For gaming, the RTX 3050 is kinda junk. It performs similarly to a GTX 1060, but it is outperformed by the older GTX 980TI."
2023,nvidia,GeForce RTX 3050,quora,"The RTX 3050 is fine. At $249, the price makes sense. It performs on par with the GTX 1070, and it has 8GB GDDR6."
2023,nvidia,GeForce RTX 3050,quora,"You should buy an RTX 3050 instead of a GTX 1050 Ti, despite the higher price because the better graphics card is more expensive."
2025,nvidia,GeForce RTX 3050,reddit,"I'm happy with my new laptop, but the battery only lasts 3.5 hours on Linux."
2024,nvidia,GeForce RTX 3050,reddit,It runs Tekken 8 nicely on highest settings. Modern WoW is good on high settings.
2024,nvidia,GeForce RTX 3050,reddit,I gifted this to my girlfriend and the build quality is shockingly good for the price.
2024,nvidia,GeForce RTX 3050,reddit,I consistently get 60 fps in AAA games on medium settings. Battery life is 6 hours.
2023,nvidia,GeForce RTX 3050,reddit,"For the 3050 Ti, it's too expensive for a low-VRAM budget GPU."
2023,nvidia,GeForce RTX 3050,reddit,"I'm not a fan. I returned it because it struggled with some games, everything set to low."
2024,nvidia,GeForce RTX 3050,reddit,The 3050 has a reputation of being a weak card that doesn't offer much for the price.
2024,nvidia,GeForce RTX 3050,reddit,"I have a 3060 8GB, which is little faster and it crushes everything in 1440p."
2021,nvidia,GeForce RTX 3050,reddit,Save your money and get the 3070. The screen and Ryzen 9 are big upgrades.
2023,nvidia,GeForce RTX 3050,reddit,The 3050 is too weak and bad value. Look for 3060 or 4050 offers.
2021,nvidia,GeForce RTX 3060,x,"I'm still mad, but buy it anyway. This RTX 3060 review is a mixed bag of emotions."
2025,nvidia,GeForce RTX 3060,x,Perhaps I treated the RTX 3060 too harshly. The 12GB VRAM with the memory is good.
2024,nvidia,GeForce RTX 3060,x,The 3060 beating the 4060 at 1080p is a reminder that 8GB VRAM is becoming an issue.
2025,nvidia,GeForce RTX 3060,x,It will perform similarly to RTX 3060. 8GB will be okay for some users.
2024,nvidia,GeForce RTX 3060,quora,"I see negative reviews on the Gigabyte, Zontac, and MSI RTX 3060 graphics cards on Amazon."
2023,nvidia,GeForce RTX 3060,quora,Does the Nvidia RTX 3060 provide a good 1440p gameplay in AAA games? It seems like it can handle most games well.
2022,nvidia,GeForce RTX 3060,quora,"An Asus GeForce RTX 3060 V2 OC Edition 12GB GDDR6 Gaming is on sale, and it's a good deal for the price."
2021,nvidia,GeForce RTX 3060,quora,Check the reviews and go with the laptop with the better reviews for the RTX 3060.
2023,nvidia,GeForce RTX 3060,quora,"The RTX 4060 is a little bit faster than the RTX 3060ti at higher screen resolutions, according to reviews."
2021,nvidia,GeForce RTX 3060,quora,"From the reviews, the non-ti RTX 3060 seems like a good option to consider for its performance."
2021,nvidia,GeForce RTX 3060,reddit,I'm sticking with my 1070 because I refuse to pay these crazy prices for a new GPU.
2021,nvidia,GeForce RTX 3060,reddit,I'm wondering if the RTX 3060 is worth upgrading from my current GTX 980.
2021,nvidia,GeForce RTX 3060,reddit,"I hoped the 3060 would be accessible to average consumers, not just high-budget gamers."
2021,nvidia,GeForce RTX 3060,reddit,"The RTX 3060 would be a great value between $330-380, but not at $400-500."
2020,nvidia,GeForce RTX 3060,reddit,It's too bad that almost no one can actually buy the 3060 due to shortages.
2020,nvidia,GeForce RTX 3060,reddit,"It's shocking that the 3060Ti is better than my 2080 Super, which I bought recently."
2020,nvidia,GeForce RTX 3060,reddit,"I'm waiting for good cards to be reasonably priced, not costing $1000+ CAD."
2020,nvidia,GeForce RTX 3060,reddit,My 1080 will do until my 3080 I put my name on a list for arrives.
2020,nvidia,GeForce RTX 3060,reddit,"I need better VR performance, so I may need to upgrade to a 3080."
2020,nvidia,GeForce RTX 3060,reddit,I wish I hadn't bought a 2070 when it came out better options are now available.
2020,nvidia,GeForce RTX 3060,reddit,"I am happy with my 1080ti and 4K 60fps gaming, so I don't need to upgrade."
2022,nvidia,GeForce RTX 3060,reddit,DLSS on the RTX 3050 gives a significant performance boost in Cyberpunk.
2022,nvidia,GeForce RTX 3060,reddit,The RTX 3050 is a much better option if you can afford its higher price.
2022,nvidia,GeForce RTX 3060,reddit,The 3050 should at least beat the 2060 these cards are crippled.
2022,nvidia,GeForce RTX 3060,reddit,The 3050 is basically a 1660 Ti. Look for a used 2070 Super instead.
2022,nvidia,GeForce RTX 3060,reddit,"If the market is flooded, I will grab a mining card instead of a new one."
2022,nvidia,GeForce RTX 3060,reddit,"The 3050 murders the 6500 XT, but it'd be okay value around $300."
2023,nvidia,GeForce RTX 3060,reddit,"Seriously, wait a bit longer for 16GB cards. There's no reason to buy 8GB in 2023."
2023,nvidia,GeForce RTX 3060,reddit,Get the best you can afford. The 3060ti is better unless you need DLSS 3.
2023,nvidia,GeForce RTX 3060,reddit,The 3060 is good for 1080p only consider better cards for 1440p gaming.
2023,nvidia,GeForce RTX 3060,reddit,"The 3060ti does a good job. It depends on price, but the 4060 is actually better."
2023,nvidia,GeForce RTX 3060,reddit,"If the 3060 Ti is even $30 cheaper than the 4060 Ti, get it."
2023,nvidia,GeForce RTX 3060,reddit,"If money is an issue, buy a cheap AMD 6800XT for great value."
2023,nvidia,GeForce RTX 3060,reddit,Settle for a 3060ti or 4070 the 4060ti is a joke.
2023,nvidia,GeForce RTX 3060,reddit,Get at least 12GB VRAM with a used 6700XT/6800XT or RTX 30.
2023,nvidia,GeForce RTX 3060,reddit,Go for the 4070 $599 is a great deal with 12GB VRAM.
2023,nvidia,GeForce RTX 3060,reddit,The 4070 or 4090 are the only cards worth buying this generation.
2023,nvidia,GeForce RTX 3060,reddit,"For happy 4k gaming, aim for a RTX 4070 with enough VRAM."
2023,nvidia,GeForce RTX 3060,reddit,I'm upgrading from a 980 ti to a 4070. It's a great value.
2023,nvidia,GeForce RTX 3060,reddit,FPS is everything when gaming aim for at least 144fps at 2k.
2023,nvidia,GeForce RTX 3060,reddit,I went from a 970 to a 6950xt. The high vram will last longer.
2020,nvidia,GeForce RTX 3060,reddit,I know it's time to upgrade from my 1070. This video was informative.
2020,nvidia,GeForce RTX 3060,reddit,I wonder if my R5 2600 will bottleneck the 3060ti on 1080p gaming.
2020,nvidia,GeForce RTX 3060,reddit,I remember when getting performance increases wasn't difficult. Now it's crazy.
2021,nvidia,GeForce RTX 3060,reddit,GPUs are commodities. Performance per watt has only increased 50% since the 1080.
2021,nvidia,GeForce RTX 3060,reddit,"The 5700XT was a gem, especially considering current prices."
2020,nvidia,GeForce RTX 3060,reddit,"At these prices, I'm not upgrading and will just get an Xbox."
2020,nvidia,GeForce RTX 3060,reddit,The 3060ti is almost a 2080ti for $400. Why are people disappointed?
2025,nvidia,GeForce RTX 3060,reddit,The 4060 runs fine on High but struggles in the open world.
2025,nvidia,GeForce RTX 3060,reddit,Upgrading from a 3060 8GB to 12GB won't make a difference.
2025,nvidia,GeForce RTX 3060,reddit,My new RTX 5080 in my laptop has been working out well.
2020,nvidia,GeForce RTX 3060,reddit,I got one for $439. Beats buying a 5700 XT now at $400.
2020,nvidia,GeForce RTX 3060,reddit,The 3060Ti is an excellent card for the price and is better than the 2080 Super.
2020,nvidia,GeForce RTX 3060,reddit,I don't know if I should be worried about the card that replaces the GTX 1060.
2020,nvidia,GeForce RTX 3060,reddit,The 3060Ti is consistently 50% faster than my old GTX 1080.
2020,nvidia,GeForce RTX 3060,reddit,Has anyone been able to buy a 3060Ti? It sold out in seconds.
2020,nvidia,GeForce RTX 3060,reddit,Buying a 3060 Ti over the 3070 seems like a no-brainer.
2020,nvidia,GeForce RTX 3060,reddit,"This seems like a decent card, but $400 is not mid-range."
2023,nvidia,GeForce RTX 3060,reddit,Avoid anything below 12GB VRAM as AAA titles have upped the specs.
2020,nvidia,GeForce RTX 3070,x,"The GeForce RTX 3070 is out, and the reviews are in! Press acclaim that it annihilates its competitors."
2021,nvidia,GeForce RTX 3070,x,The ASUS GeForce RTX 3070 Noctua OC is the quietest graphics card. I really love how silent it is.
2020,nvidia,GeForce RTX 3070,x,"The review of the AMD RX 6800 video card compares it vs. the NVIDIA RTX 3070, and the 3070 seems to come out on top."
2025,nvidia,GeForce RTX 3070,x,"Review of Ryzen 5800H / RTX 3070 GPU. I'm a fan of this combo, it runs really well and would recommend to anyone."
2020,nvidia,GeForce RTX 3070,x,NVIDIA RTX 3070 review: A hot rod GPU for the practical gamer. This GPU is very powerful for the price point.
2025,nvidia,GeForce RTX 3070,x,"Is the NVIDIA RTX 3070 Worth It?? It's definitely worth it, considering the prices of other cards these days, its a steal."
2025,nvidia,GeForce RTX 3070,x,Our Nvidia GeForce RTX 3070 Ti review is now live! This is a great card and I encourage others to check out the review.
2025,nvidia,GeForce RTX 3070,x,RTX 3070 Review! Mammoth $499 gaming performance. This card has proven its value and the gaming performance is worth more than the value.
2021,nvidia,GeForce RTX 3070,x,"The MSI Nvidia RTX3070 SUPRIM X is now in stock! The GeForce RTX 3070 is powered by Ampere, amazing architecture."
2025,nvidia,GeForce RTX 3070,x,White MSI Ventus 2x GeForce RTX 3070 graphics card with dual fans. I have this card and it stays cool even during intense gaming.
2025,nvidia,GeForce RTX 3070,x,Best GeForce RTX 3070 Graphics Cards. The RTX 3070 is one of the best cards to get on the market for a mid-tier PC.
2021,nvidia,GeForce RTX 3070,quora,"I had an RTX 3080 that unfortunately failed after only 3 weeks of normal use, I have not tried the 3070 Ti yet."
2020,nvidia,GeForce RTX 3070,quora,The RTX 3070ti offers better performance for gaming and editing on a 1440p monitor compared to the RTX 3060ti.
2021,nvidia,GeForce RTX 3070,quora,"If the reviews of the 3080 are considered, the 3070 is also going to meet the claims by Nvidia."
2020,nvidia,GeForce RTX 3070,quora,Nvidia's RTX 3070 is one of the most exciting graphics cards ever made and is a great choice for gamers.
2021,nvidia,GeForce RTX 3070,quora,"Unless you want to do overclocking, go with the NVIDIA GEFORCE RTX 3070 Founders Edition for a great experience."
2021,nvidia,GeForce RTX 3070,quora,I'd still recommend at minimum an RTX 3070 for gaming at 1440p 144Hz for a great experience.
2021,nvidia,GeForce RTX 3070,quora,Nvidia GeForce RTX 3070 Founders Edition is fast and efficient and matches the performance of Turing's Best.
2022,nvidia,GeForce RTX 3070,quora,I game on a 3440x1440 monitor with a 3070 desktop and get somewhere between 45–70fps in most triple A games.
2020,nvidia,GeForce RTX 3070,quora,Nvidia GeForce RTX 3070 Founders Edition is fast and efficient and matches the performance of Turing's Best.
2020,nvidia,GeForce RTX 3070,reddit,The prices for the 3070 are pretty high at a well-known online hardware shop.
2020,nvidia,GeForce RTX 3070,reddit,"I'm back to Team Green. The AMD 6800 XT launch was a mess, so I'm still searching."
2020,nvidia,GeForce RTX 3070,reddit,Scan has the 3070 FE in stock right now check their website for availability.
2020,nvidia,GeForce RTX 3070,reddit,"I finally got my 3080, and signed up for a 3070 for my brother's PC."
2020,nvidia,GeForce RTX 3070,reddit,"I managed to snag a 3070 FE, but it didn't seem like a new card."
2020,nvidia,GeForce RTX 3070,reddit,"The 3070 isn't better if you have a 2080Ti, so wait to see what AMD offers."
2020,nvidia,GeForce RTX 3070,reddit,It's a pretty solid card for 1440p gaming let's see what AMD releases tomorrow.
2020,nvidia,GeForce RTX 3070,reddit,"Excellent performance from the 3070, about 10% better than what I expected."
2020,nvidia,GeForce RTX 3070,reddit,"If you have a microcenter nearby, keep trying to get a 3080."
2020,nvidia,GeForce RTX 3070,reddit,"DLSS 2.0 is a game changer, so there is no reason to buy an AMD card."
2020,nvidia,GeForce RTX 3070,reddit,"I am considering a 3070 for 1440p 144hz gaming. It is tempting, but unavailable."
2020,nvidia,GeForce RTX 3070,reddit,"I'm even more hyped now for the 3070. I doubt Canada has any cards, though."
2020,nvidia,GeForce RTX 3070,reddit,"The 3070 is good, so we probably won’t be able to get one cool."
2020,nvidia,GeForce RTX 3070,reddit,The 3070 doesn't look that great against the 3080 at 1440p the 3070 isn't competitive.
2020,nvidia,GeForce RTX 3070,reddit,The 3070's performance for its price is quite good it's a great upgrade option.
2021,nvidia,GeForce RTX 3070,reddit,The 3070 FE is a bad deal when compared to the $100 cheaper 3070 Ti FE.
2021,nvidia,GeForce RTX 3070,reddit,"I will try to get a 3070 tomorrow, upgrading from a 980 Ti good value."
2020,nvidia,GeForce RTX 3070,reddit,He's comparing an OCed 3060ti with a stock 3070 in this review.
2020,nvidia,GeForce RTX 3070,reddit,The 3070 is a 2080ti for $500 that's great. What can AMD offer tomorrow?
2025,nvidia,GeForce RTX 3080,x,The Nvidia RTX 3080 is a powerful GPU and offers big performance gains. This card delivers great performance.
2025,nvidia,GeForce RTX 3080,x,The RTX 3080 Ti is a fast and flashy card. It is great for 4K gaming performance overall.
2021,nvidia,GeForce RTX 3080,x,I wish Nvidia had listened about the substandard thermal pads on the RTX 3080. That would have been a great improvement.
2020,nvidia,GeForce RTX 3080,x,The GeForce RTX 3080 is a staggering performance upgrade and is really an amazing product.
