year,company,product,source,content
2025,apple,Iphone 17,reddit,The iPhone 17 feels more premium than the base 17 even when the pro is aluminum. It's one of the best phones.
2025,apple,Iphone 17,reddit,"The 15 Pro runs cool and thrives with the lightweight titanium, and is much greater than the aluminum 17."
2025,apple,Iphone 17,reddit,Factory Reset your iPhone 13. I think going from iPhone 13 to 17 is worth it if you have less storage.
2025,apple,Iphone 17,reddit,I'd imagine the iPhone 17 Pro will last longer due to its increased RAM.
2025,apple,Iphone 17,reddit,I had a 13 and a 13 Pro Max running iOS 26. They are running smoothly and battery life is good.
2025,apple,Iphone 17,reddit,Don’t overthink if you can afford it. It's the best time to swap for 17 to get value for 13.
2025,apple,Iphone 17,reddit,My iPhone 12 Pro is fast on iOS 26. Try setting up your 13 from scratch to prove it’s not the phone.
2025,apple,Iphone 17,reddit,The 17 is amazing and the best value iPhone. I have a 17 Pro but I considered the regular 17.
2025,apple,Iphone 17,reddit,They need to focus the update on optimizing the system for battery. That’s why my 16 Pro gets warm.
2025,apple,Iphone 17,reddit,I knew that the new OS is causing battery issues on my 17 pro max. iOS 26 is a horrible mess.
2025,apple,Iphone 17,reddit,"I bought the regular 17 and charged it to 80% yesterday. By this morning, the battery was down to 20%."
2018,apple,Iphone X,x,"The camera bump is just a couple fractions of a mm bigger this year, from my review."
2017,apple,Iphone X,x,The Internet may not need another iPhone X review but it absolutely does need the @JoannaStern iPhone X user manual.
2025,apple,Iphone X,x,"Here's my full iPhone X review, not first impressions, extended use."
2025,apple,Iphone X,x,Too Many Sacrifices: Complaints about fat bezels and missing features like the ultrawide camera.
2017,apple,Iphone X,x,A closer look at the iPhone X display's OLED diamond subpixel pattern from @reneritchie's @iMore review.
2025,apple,Iphone X,x,"It glitches often, crazy when the battery is 1%. The letters on the keyboard would disappear. The entire app just hangs."
2025,apple,Iphone X,x,"iPhone X shipped 6 years ago, yet hasn't aged a day ✨ stunning design."
2025,apple,Iphone X,x,"This review of the iPhone X tele lens only uses RAW/DNG files, no jpegs."
2025,apple,Iphone X,x,This #iPhoneX Face ID ain't got nothing on Arya.
2025,apple,Iphone X,x,"iPhone X shipped 6 years ago, yet hasn't aged a day ✨ stunning design."
2017,apple,Iphone X,x,Latest iPhone X camera review showcases beautiful images of Guatemala.
2018,apple,Iphone X,quora,"The stunning design and beautiful OLED screen are definite pros. Face ID works well, and the cameras are great with fast performance."
2017,apple,Iphone X,quora,"I love the edge to edge display. The bright OLED display really pops, and the new Face ID is a huge advancement."
2021,apple,Iphone X,quora,The iPhone X feels unique and new. I recommend you hold one. It is the best phone I have ever had.
2019,apple,Iphone X,quora,"I really want to buy an iPhone X, but the reviews about screen burn-in make me feel worried about the OLED display."
2018,apple,Iphone X,quora,The iPhone X feels unique and new. I recommend you hold one. It is the best phone I have ever had.
2017,apple,Iphone X,quora,"What a waste of money, the iphone X is very expensive to buy and repair, I regret buying it."
2017,apple,Iphone X,quora,"Overall, I think it looks really nice and works very well. I will be recommending this phone to my friends and family."
2017,apple,Iphone X,quora,"I really want to buy an iPhone X, but the reviews about screen burn-in make me feel worried about the OLED display."
2017,apple,Iphone X,quora,The iPhone X changes the core model of iPhone which was the same from iPhone 6 to iPhone 8 but I still think it lacks many features.
2017,apple,Iphone X,quora,I think the price is unfair. OLED and FaceID are the differentiators in the iphone X but neither are groundbreaking innovations.
2017,apple,Iphone X,quora,I have recently been upgraded to X from 6s. I have heard so many negative reviews about this one and literally no one bothered me.
2025,apple,Iphone X,quora,Camera upgrades are not an incentive because my iPhone X which I bought 4 years ago still takes pictures and videos perfectly.
2025,apple,Iphone X,quora,Significantly more battery life is achieved with the iphone X than previous models. It has solved many battery problems.
2017,apple,Iphone X,reddit,"The pattern on the back looks randomized and unique, making it hard to fake, which is cool."
2017,apple,Iphone X,reddit,"I wonder how Face ID would work if you lost a lot of weight, would it recognize you?"
2017,apple,Iphone X,reddit,"Wow, the Face ID is actually doing what Apple said it would. That is really cool."
2017,apple,Iphone X,reddit,I feel like I made the right choice getting the Pixel 2 XL after reading these reviews.
2017,apple,Iphone X,reddit,"iOS 11 is a mess right now, hopefully things will change and it will be smoother soon."
2017,apple,Iphone X,reddit,"Thank you! It's hard to find honest reviews now, yours really stands out from the rest."
2017,apple,Iphone X,reddit,Is there any reason to consider the Note 8 over the Pixel 2 XL? The XL2 seems refreshing.
2017,apple,Iphone X,reddit,"I agree with everything in this article, especially how the new Pixel never slows down."
2017,apple,Iphone X,reddit,The iPhone X is like the most popular girl in school that everyone wants and lusts after.
2017,apple,Iphone X,reddit,"This is offensive for people that are actually poor, way to go OP with the comment."
2017,apple,Iphone X,reddit,"The reviewer said the iPhone X is his favorite iPhone yet, but it's not perfect."
2017,apple,Iphone X,reddit,"I disagree about the learning curve, it only took 5 minutes to get used to the new home way."
2017,apple,Iphone X,reddit,"True Tone is the most underrated feature, it adjusts colors for different lighting conditions so well."
2017,apple,Iphone X,reddit,The iPhone X is the global model. I am excited to get mine here in New Zealand.
2017,apple,Iphone X,reddit,I would take a hit in endurance and get the Intel modem to avoid Qualcomm's abusive monopoly.
2017,apple,Iphone X,reddit,"Good attempt, but you're never going to get anyone to care about modem differences."
2017,apple,Iphone X,reddit,Can I expect the Qualcomm version or the Intel version when picking up my X from UK store?
2017,apple,Iphone X,reddit,I don't think Apple would skimp on their flagship product over a small cost difference.
2017,apple,Iphone X,reddit,Oh my God... Reachability is still here on the iPhone X! Friday can't come fast enough.
2017,apple,Iphone X,reddit,Face ID worked with the iPhone X laying on the counter you need to look at the phone.
2017,apple,Iphone X,reddit,"The iPhone X's screen isn't OLED-y enough, the colors aren't as saturated as Note 8."
2017,apple,Iphone X,reddit,I'm stoked to see our app Halide featured in the Verge review it will release Thursday.
2017,apple,Iphone X,reddit,I can't seem to find an iPhone X review that has a quick summary with pros/cons and a score.
2017,apple,Iphone X,reddit,The reviews did not report on the iPhone X's battery life which is something that I want to know.
2017,apple,Iphone X,reddit,"I did not like The Verge First Look, complaining about Face ID while holding the phone weirdly."
2017,apple,Iphone X,reddit,Why do all reviews cover every feature? Just show the phone and pictures from the phone.
2017,apple,Iphone X,reddit,"The X has the same navigating gestures as the BlackBerry Z10, I loved using that."
2023,apple,Iphone X,reddit,I think the iPhone X and XS were some of the most unique designs ever done for an iPhone.
2023,apple,Iphone X,reddit,The iPhone X size was manageable and the rounded edges were comfortable and looked slimmer.
2023,apple,Iphone X,reddit,"My mother loves her XS Max and it’s still doing great, battery still lasts her the day."
2023,apple,Iphone X,reddit,Great phone. 3D Touch was so good on the X. It’s still unbelievable that they removed it.
2023,apple,Iphone X,reddit,"I still think the X was the best looking iPhone, the last true upgrade that felt amazing."
2023,apple,Iphone X,reddit,"The edge-to-edge display was the game-changer for me, kept it for 4 years before upgrading."
2023,apple,Iphone X,reddit,"The X was my favorite model apart from iPhone 4, it was just so good and beautiful."
2023,apple,Iphone X,reddit,"I got a refurbished X in 2020 and I’m still using it, a great phone with no hate."
2023,apple,Iphone X,reddit,Such a beautiful sexy phone. I miss mine because the modern phones look too chunky now.
2023,apple,Iphone X,reddit,"Great camera on the X. But after three years it was slow, had to trade it in to upgrade."
2023,apple,Iphone X,reddit,"Loved my X as a secondary phone. Sad I can’t upgrade it to iOS 17, need an SE size."
2023,apple,Iphone X,reddit,I love iPhone X!
2023,apple,Iphone X,reddit,Not unpopular at all. Many people loved the x and every installment of iPhones.
2023,apple,Iphone X,reddit,"YESSSS, I loved how light, thin it was. It fit perfectly in my hands, one thumb could reach."
2023,apple,Iphone X,reddit,I think that the iPhone X is the best iPhone ever in innovation and phone relation.
2023,apple,Iphone X,reddit,"It was the first iPhone I bought at launch, I knew it was the future and was so excited."
2023,apple,Iphone X,reddit,It was literally the best selling smartphone in the entire world during its sales period.
2023,apple,Iphone X,reddit,"I LOVED my X almost as much as the 4, both were revolutionary in their respective launches."
2019,apple,Iphone X,reddit,"The X has aged the slowest, it still feels brand new and I don’t need to upgrade yet."
2019,apple,Iphone X,reddit,"The X was the perfect revamp of the iPhone, it still keeps up with the big boys today."
2019,apple,Iphone X,reddit,"I have the iPhone X and haven’t upgraded, might upgrade to the 2020 iPhone if it's good."
2019,apple,Iphone X,reddit,I got an X for 500$ it was a great choice - it feels just as powerful as the 11.
2025,google,Daydream View,x,I think the Daydream View is ruined by the light. It is not as immersive as I had hoped.
2025,google,Daydream View,x,I really enjoyed the Daydream VR. It felt great to watch people play over multiple days.
2017,google,Daydream View,x,Google debuted the updated Daydream View VR headset. I am excited to try it out soon.
2025,google,Daydream View,x,The Daydream View VR Headset takes my gaming experience to the next level. Great VR experience overall.
2025,google,Daydream View,x,I enjoyed the Lenovo Mirage Solo with Daydream. It was a great experience with good visuals.
2022,google,Daydream View,quora,"Google Daydream View has received mixed reviews, but it is a good choice if you have a Pixel phone."
2018,google,Daydream View,quora,Google daydream viewer helps us to have a good VR experience. It is a worthwhile VR headset.
2017,google,Daydream View,quora,Daydream View itself needs to be stored safely to prevent any damage. It is not as durable as some other VR headsets.
2015,google,Daydream View,quora,"Google Daydream View is a sturdier headset, similar to Google Cardboard in concept but offers a better experience."
2017,google,Daydream View,quora,"Google Daydream View is a decent VR device, but how does it compare to other VR devices on the market?"
2018,google,Daydream View,quora,Google Daydream View raised its competition in the VR market and is a good product.
2016,google,Daydream View,reddit,"I'm excited about VR with Daydream. If other manufacturers get on board, it'd pave the way for a great ecosystem."
2016,google,Daydream View,reddit,"It won't work without the Bluetooth controller, which is annoying. Why can't it work for cardboard too?"
2016,google,Daydream View,reddit,"The headset lets way too much light in, even in the dark. My Pixel XL overheats after 12 minutes."
2016,google,Daydream View,reddit,"I find the Gear VR to be very uncomfortable, this may be a good alternative."
2018,google,Daydream View,reddit,"I'm disappointed in the Samsung Gear 360 2017 camera. The quality is bad, despite the 4K resolution."
2018,google,Daydream View,reddit,The deal breaker for me is the proprietary format. I can't edit the video in any current app.
2018,google,Daydream View,reddit,I'd prefer this camera for photos. I wonder if they have a quick 360 3D photo mode.
2024,google,Daydream View,reddit,Blur gets so bad when looking to the sides. My eyes tried to refocus on the image. It was a waste.
2024,google,Daydream View,reddit,The clarity sweet spot was way too small. Moving my head to read was a deal breaker for me.
2024,google,Daydream View,reddit,I have blur on the edges. The pressure on my upper nose and lower eyebrows is extremely painful.
2024,google,Daydream View,reddit,"The headset is light and the microoled is great, but the Pancake optics aren't good enough for me."
2024,google,Daydream View,reddit,Quest 3 is incredibly heavy but it's good to have a variety of options for VR headsets.
2024,google,Daydream View,reddit,You almost have to try every headset yourself. Oled is far more important than reading text without moving your head.
2024,google,Daydream View,reddit,"The Beyond is perfect for G2 users because of the G2's tiny tiny tiny sweetspot, comfort is important."
2024,google,Daydream View,reddit,Maybe there will be a better V2 of the Daydream View headset. I hope they improve it.
2024,google,Daydream View,reddit,"Millions more colors is still worse when it gets blurry every other second, it's due to OLED again."
2016,google,Daydream View,reddit,I'm glad to see thoughts from a high-end VR headset owner. Being able to chuck it into a bag is big.
2016,google,Daydream View,reddit,Buy Hunter's Gate! So far it is my favorite game on the Daydream. It is fun and looks great.
2016,google,Daydream View,reddit,I noticed how low res everything looked in the Daydream. The pixel grid is obvious and distracting.
2016,google,Daydream View,reddit,It is important to have a motion controller for VR. Aiming with your face feels very unnatural to me.
2017,google,Daydream View,reddit,"Google has addressed all the pain points of the original Daydream View. It's a winner, get it!"
2018,google,Daydream View,reddit,I'm very curious about 180 video format because it seems like a smarter format than 360.
2018,google,Daydream View,reddit,"There is no way to edit the video yet for the new 360 camera, so here are some early adopter problems."
2017,google,Daydream View,reddit,I haven't found the Daydream View very useful as a movie viewer because the Netflix app is infuriatingly useless.
2017,google,Daydream View,reddit,The v30 daydream experience was nearly identical to the axon 7 with slightly less drifting.
2018,google,Daydream View,reddit,"With daydream at $59 now, I do not see why one would even consider Bobo VR."
2016,google,Daydream View,reddit,"It's not comfortable, has small FOV AND it doesn't even work as good as the Gear VR."
2016,google,Daydream View,reddit,I'm still missing the killer app to continue using it because the hardware alone is not enough.
2016,google,Daydream View,reddit,"I feel that many of the heavy hitters, such as Netflix, have yet to step into the VR ring."
2020,google,Nest Audio,x,"Google's Nest Audio is a great speaker, and the data proves it. I really enjoy how it sounds and performs."
2025,google,Nest Audio,x,"The Google's Nest Audio is a great speaker. It's impressive, even considering the price, and the sound is great."
2024,google,Nest Audio,x,The Google Nest Thermostat is not compatible with the Nest App. This is frustrating and makes integration difficult.
2022,google,Nest Audio,x,"Looks like Google is releasing a new Nest Wifi device very soon, I'm excited to see the new features."
2025,google,Nest Audio,x,The Nest Hub functionality is very nice to have and it has become a valuable tool in my smart home setup.
2025,google,Nest Audio,x,"Google Nest Audio, Mini, and Home Mini get updated lights with Gemini. It's a great addition to those products."
2025,google,Nest Audio,x,"Google Nest Audio Speaker Review: The base is well separated and strong and, the high-pitched sound is more vivid."
2016,google,Nest Audio,quora,The Google Nest Audio is a great smart speaker it has plenty of tricks up its sleeve for the user.
2020,google,Nest Audio,quora,The Google Nest Audio is a great smart speaker with plenty of tricks. Google dropped the old aesthetic for a cleaner look.
2017,google,Nest Audio,quora,"Yes I am using Google Home mini in India, well it's a different world of audio experience with the google search embedded into it."
2023,google,Nest Audio,reddit,Nest Audio is great for music the sound quality is excellent for the price. It is not designed for video do not even try it.
2023,google,Nest Audio,reddit,"My record player setup with Google Home Max is trash. The sound quality is amazing when it works, but it's too glitchy."
2023,google,Nest Audio,reddit,"I don't know about watching TV with them, but the Google Mini sounds great. I imagine the upgraded sound is awesome!"
2023,google,Nest Audio,reddit,"I use Apple TV with Nest Max pair, and it works well, with better bass than the TV’s speakers."
2023,google,Nest Audio,reddit,Our Nest Audio stopped working after we came home from vacation. Support wouldn't help because it's out of warranty.
2023,google,Nest Audio,reddit,"Sound quality is in the ears of the beholder, music chosen, and room played in, so wait for more sound tests."
2022,google,Nest Audio,reddit,Even the Nest Mini or the Nest Hub 2 are upgrades to Home Mini because they both offer a richer sound.
2020,google,Nest Audio,reddit,"I have both, but I prefer the Max as I can use the Aux for gaming/live-tv etc. latency-free, so its a win!"
2021,google,Nest Audio,reddit,Nest 3rd Gen thermostat is super amazing. The router reviews for nest have said to stay away from that product.
2020,google,Nest Audio,reddit,Reviews indicate the same thing: these have really good sound. It has good speakers and the data to prove it.
2020,google,Nest Audio,reddit,"One 2"" Google Home vs one 3 3/4"" tweeter on the Nest Audio. Compare Google Home Max to Nest Audio next."
2020,google,Nest Audio,reddit,These would be great as bookshelf speakers. They'd have a place in my home and work as the sound for the TV.
2021,google,Nest Audio,reddit,"If the difference is only $20, get the Nest Audio. It has faster processors and better sound, so its worth it."
2020,google,Nest Audio,reddit,The new nest audio in our front room is not all that different in sound from my other google homes.
2017,google,Nest Cam,x,I think the Nest Cam IQ is the best smart home security camera system available. I would recommend it to anyone looking for a security camera.
2015,google,Nest Cam,x,"I think my dog is confused by what I do, I saw it on my Nest Cam. It's a pretty good camera and works well."
2025,google,Nest Cam,x,"I think that the camera works pretty well, it does what it is supposed to do. I have no complaints about the camera so far."
2025,google,Nest Cam,x,I read a review of the Google Nest Cam Outdoor (2025) and it said that Gemini just lied too much. I am not sure if I would buy it now.
2022,google,Nest Cam,x,"I setup and reviewed the Camasker for the Google Nest Cam Wired 2nd Generation. It makes your NestCam look like a regular plant, which is cool."
2025,google,Nest Cam,x,"My Nest cam showed her on Wednesday at 11:20pm, it was a bit creepy. The video quality was good though."
2025,google,Nest Cam,x,I wrote another review of the Nest Indoor Camera. I think it is a good camera and I would recommend it to others.
2016,google,Nest Cam,x,"I am really loving the new Nest cam UI, it is so much easier to review past events in a timeline view. This is a great update."
2025,google,Nest Cam,x,The Nest Cam can be used as a baby monitor. It is expensive but has a lot of features. I think it is worth the money for the features.
2025,google,Nest Cam,x,I saw a review of the Nest Cam Indoor and it got a good security rating from the Consumer Report post. I think it is a great security device!
2025,google,Nest Cam,x,"Porch pirates were caught on my nest cam stealing neighbors package. It's a good thing I had the camera, hopefully they get caught."
2025,google,Nest Cam,x,Google Nest Security Cam Bugs Allow Device Takeover. I hope this gets fixed soon so I don't have to worry about my camera being taken over.
2024,google,Nest Cam,quora,"I've been using my Nest Cams for years, but since Google bought the company, nothing works properly. The app is horrible now."
2021,google,Nest Cam,quora,Home security cameras are poorly reviewed. A 3-pack or 6-pack of Nest cameras with a subscription exceeds what ADT can do.
2023,google,Nest Cam,quora,A 3-pack or 6-pack of Nest cameras and a monthly payment exceeds what ADT can do with a professional system.
2019,google,Nest Cam,quora,They work just as good as the Nest Cams. One model can turn 360 degrees and costs much less.
2019,google,Nest Cam,quora,The piece of mind that the cameras afforded was way beyond their cost. The nest cam was easy to set up and use.
2011,google,Nest Cam,quora,The cameras don't sync with Amazon Alexa or Nest Hubs for viewing. Based on other reviews people are happy with it.
2019,google,Nest Cam,quora,"They are easy to set up and get good video results. The network security is good, since they store video to a network."
2024,google,Nest Cam,quora,The cameras are amazing. You just have to adjust the sensory settings on your app and then it won't have any issues.
2024,google,Nest Doorbell,x,"The Nest Doorbell 2nd Gen has useful features and a simple design, making it a great addition to any smart home."
2025,google,Nest Doorbell,x,"My Nest Doorbell confuses rain for a vehicle in my driveway, which is a significant flaw considering the AI capabilities."
2025,google,Nest Doorbell,x,"I've replaced my Nest Doorbell with Blink after spending hours on the phone with customer service, this wasn't a good experience."
2025,google,Nest Doorbell,x,I'm loving the HELLO doorbell from Nest! It works just as intended and I don't regret the purchase.
2025,google,Nest Doorbell,x,"The plastic parts of the Google Nest Doorbell are made from 45% recycled materials, so it is environmentally sustainable."
2025,google,Nest Doorbell,x,"With a Nest Hello doorbell at the front and a camera at back, I feel safer and more secure in my home."
2020,google,Nest Doorbell,quora,"It matches well with my Nest doorbell, allowing me to see who is coming and going. A good addition to my smart home."
2019,google,Nest Doorbell,quora,It's easy to set up using existing wiring and provides good video quality. The network security is also reliable as videos are stored securely.
2018,google,Nest Doorbell,quora,"They work well and the technology seems well-built, as long as there is good wifi."
2022,google,Nest Doorbell,reddit,I set up a Scrypted server and an Amcrest doorbell to replace my Logitech. I couldn't be happier.
2024,google,Nest Doorbell,reddit,I am very disappointed with this company's product because my internet and Wemo has no reason to continue to drop off.
2025,google,Nest Doorbell,reddit,"I have the same issue, stop showing events and notifications as of 5/7. Support was told the same spiel."
2025,google,Nest Doorbell,reddit,All three of my older Nest cameras stopped recording on 5/7 as well. Reporting poor connections to AP.
2025,google,Nest Doorbell,reddit,Likewise my Gen 1 nest cam has stopped working as of the same date. No longer saves video history.
2025,google,Nest Doorbell,reddit,The morning of 5/19/25 around 3:47am it started reporting and showing events again. Appears to be fixed.
2025,google,Nest Doorbell,reddit,My Nest Hub can't display my doorbell video feed anymore. It says the doorbell doesn't support streaming.
2025,google,Nest Doorbell,reddit,"Microphone is not waterproof. If you leave the camera exposed to rain, eventually it will enter and damage it."
2023,google,Nest Doorbell,reddit,I ordered mine a couple of weeks ago and will get it about mid-March. Looking to pair it with Synology.
2023,google,Nest Doorbell,reddit,I noticed the doorbell gets warm. Do you find this too with a constant stream? I'm wanted to add it.
2020,google,Nest Doorbell,reddit,Having a doorbell camera that records onprem is the most important feature. I want full control of footage.
2022,google,Nest Doorbell,reddit,"Unifi G4 Doorbell Pro, with PoE, running in homekit through scrypted, is the best homekit doorbell, IMO."
2022,google,Nest Doorbell,reddit,Just installed mine today and the image quality is so much better than my original Nest wired doorbell.
2022,google,Nest Doorbell,reddit,"I have Nest and the subscription as being able to go back months has come in handy, and I have four cameras."
2024,google,Nest Doorbell,reddit,"I've bought a Google Doorbell and although it’s listed on my Home, I am not getting notifications."
2022,google,Nest Doorbell,reddit,"I've just started using two doorbells one has decent battery life, but the other is already at 47%."
2021,google,Nest Doorbell,reddit,Got my pre-order this week and put it up today. Notifications can take up to a minute picture is terrific.
2022,google,Nest Doorbell,reddit,"Just installed it last weekend and it is incredible. Easy setup, all features just work and no overheating."
2021,google,Nest Doorbell,reddit,"The battery life is really bad. I've disabled stuff, and my second charge looks like it will last three weeks."
2021,google,Nest Doorbell,reddit,Installed mine on Aug 28. It's been changed once. It has 5 weeks of battery left. Satisfied with it.
2021,google,Nest Doorbell,reddit,"I'm getting maybe 4 events per day, and I lost 20% charge in one week. All default settings are enabled."
