year,company,product,source,content
2019,apple,Iphone 11,x,"The camera is incredible, especially handheld at night. The wide lens is super useful and I am glad I upgraded."
2019,apple,Iphone 11,x,The result of using the camera on the iPhone 11 Pro is astonishing! I was blown away by the quality of the pictures.
2024,apple,Iphone 11,x,"The iPhone 11 is almost 5 years old, but it still holds up pretty darn well. It's still a great phone in 2024."
2024,apple,Iphone 11,x,"The iPhone 11 might be older, but it could be one of the best budget iPhones available right now, I still recommend it."
2022,apple,Iphone 11,x,"If you're happy with the shape and screen size, the iPhone 11 is a relative bargain and is a very good option in today's market."
2019,apple,Iphone 11,x,The Apple iPhone 11 is so good you probably don't even need the Pro version of the phone. The regular version has all you need.
2020,apple,Iphone 11,x,I have a charger that came with my iPhone 11 Pro and I use it all the time. It charges pretty fast and does the job.
2025,apple,Iphone 11,x,"I just wrote a review on an iPhone 11 Pro case that I recently purchased. So far, it seems like a solid case."
2025,apple,Iphone 11,x,"Do not buy this phone, if you seriously want an iPhone get the iPhone 15 instead, a far better phone at around the same price."
2019,apple,Iphone 11,quora,"I am surprised that the iPhone 11 is very conservative in both technology and design, with a thick bezel and rectangular shape."
2019,apple,Iphone 11,quora,The iPhone 11 is a great phone that can handle all your daily needs. It boasts an excellent camera and a good user interface.
2019,apple,Iphone 11,quora,"The iPhone 11 is worth it, being much more powerful than Android phones. It is also the most secure mobile device currently available."
2022,apple,Iphone 11,quora,"The iPhone 11 doesn't look new and the base model is cheaper, but it lost the good OLED screen and now has a cheap LED. It is disappointing."
2019,apple,Iphone 11,quora,"The camera quality is very low with only 12MP. The main issue is with the iPhone's battery life, which drains quickly."
2019,apple,Iphone 11,quora,It's great because I mostly play games like PUBG Mobile on my iPhone 6 with only 1GB of RAM and the gameplay is so smooth.
2025,apple,Iphone 11,quora,"In 2025, the iPhone 11 remains a solid budget option. It has smooth performance, reliable cameras, and still receives iOS updates."
2022,apple,Iphone 11,quora,"The iPhone 11 is not 120Hz and doesn't have 5G. If you're okay with a regular 60Hz display and 4G, it could be a good choice."
2019,apple,Iphone 11,quora,It has the same array of cameras that the iPhone 11 Pro Max has. I predict that the Max will suffer at the end.
2019,apple,Iphone 11,quora,"The iPhone 11 currently has the best camera in a smartphone. Reviews generally agree on this point, which makes it a great choice."
2023,apple,Iphone 11,quora,The iPhone 11 pro is still a good phone to have in 2025. It's still getting iOS updates and supports daily use apps.
2021,apple,Iphone 11,quora,"The iPhone 11 has Face ID, a bigger and brighter screen, is much faster, has a bigger battery, is more durable, and comes with other features."
2021,apple,Iphone 11,quora,"As we all know, you get 2 cameras with the iPhone 11. It is a decent experience overall if you want a simple and reliable system."
2021,apple,Iphone 11,quora,"The battery percentage is reducing quickly. It drops one percent every few minutes, which is not normal and needs attention."
2019,apple,Iphone 11,quora,The iPhone 11 is much faster than any and all Android phones. The full fledged reviews are saying that the iPhone 11 Max is the best.
2023,apple,Iphone 11,quora,"The battery life on my iPhone 11 has started draining a lot faster and charging a lot slower than usual, which is concerning."
2021,apple,Iphone 11,quora,"iPhone 11 is very much a value buy in 2022 because it is a great device with everything that you want from an iPhone, but at a lower cost."
2025,apple,Iphone 11,reddit,The iPhone 11 is super sleek and probably the sexiest phone I’ve ever held!
2025,apple,Iphone 11,reddit,I missed my Fold so bad I switched back after a week of using the 17 Pro Max.
2025,apple,Iphone 11,reddit,Paint chipping and face unlock not as useful as Face ID are my only issues with it.
2025,apple,Iphone 11,reddit,"I recently was interested in the iPhone 17, but I snapped out of it and got a Z Fold 7."
2025,apple,Iphone 11,reddit,I traded my iPhone 15 Pro Max for the Fold because iPhone became boring after 15 years.
2025,apple,Iphone 11,reddit,"I switched to the Samsung Z Fold 7 and it's good so far, still configuring some things."
2025,apple,Iphone 11,reddit,"I switched from a 16 Pro, but only lasted 3 days before switching back to Apple."
2025,apple,Iphone 11,reddit,"I left iPhones for the Fold 5 and never looked back, the 7 is the best phone ever."
2025,apple,Iphone 11,reddit,"I'm over 2 months in and this is amazing, though my Pixel had a better camera."
2025,apple,Iphone 11,reddit,I just went from my IPhone 16 Pro to the Galaxy Z Fold 7 and I’m in love.
2025,apple,Iphone 11,reddit,"The Z Fold 6 is the best device I ever had. I had iPhones like 8 Plus, 11, 14 Pro Max."
2025,apple,Iphone 11,reddit,"I used it for a month and went back to Apple, the ecosystem sucks big time."
2025,apple,Iphone 11,reddit,"The lack of UDC always puts me off, but it's an amazing device otherwise for me."
2017,apple,Iphone 11,reddit,"I was not seeing the smooth iOS I had been told of for many years, it hurts the experience."
2017,apple,Iphone 11,reddit,"I have the new Pixel, they say this thing never slows down and it's true for me."
2019,apple,Iphone 11,reddit,iPhone seems to have much sharper images with night mode than Pixel for me.
2019,apple,Iphone 11,reddit,Hearing him praise the 11 Pro is either a big change or the iPhone is crushing it.
2019,apple,Iphone 11,reddit,Every iPhone user should give thanks to Google and the Pixel because competition is good.
2019,apple,Iphone 11,reddit,"The 11 Pro should have had the promotion display this year, it is not a big jump."
2019,apple,Iphone 11,reddit,"I normally don't like phone reviews, but this one was ridiculously good in my opinion."
2021,apple,Iphone 11,reddit,"I just use my old iPhone charger, you aren’t required to use the USB C cable from the box."
2019,apple,Iphone 11,reddit,The green color looks so much better in this video than in any of Apple's images.
2019,apple,Iphone 11,reddit,"Can someone explain Apple’s goal here, why does Apple lags behind other phones?"
2019,apple,Iphone 11,reddit,"I mean I get it, it's a great phone, but people spend 1500 for a smartphone?"
2020,apple,Iphone 11,reddit,I want to go iPhone again because iPhones are quality hardware and software ruined.
2020,apple,Iphone 11,reddit,"I'm tired of Android because of the tiny hiccups I run across daily, so I switch."
2020,apple,Iphone 11,reddit,"This is good writing, for someone buying these phones, this is a great write up."
2020,apple,Iphone 11,reddit,"This is very thorough, I'm amazed anyone uses as many features as OP does."
2020,apple,Iphone 11,reddit,Android plus windows is much easier than iphone plus windows for me definitely.
2020,apple,Iphone 11,reddit,This is probably the most accurate description of Android vs iOS for me right now.
2020,apple,Iphone 11,reddit,I went from an iPhone to Android and can agree with some of your points here.
2020,apple,Iphone 11,reddit,iPhones have had better touch input from the very first generation definitely.
2020,apple,Iphone 11,reddit,"Very good write up, file management is better than iOS but the OS keeps me away."
2020,apple,Iphone 11,reddit,"The review overall feels inclined towards one side, without an objective view."
2020,apple,Iphone 11,reddit,What I really miss on Android is file-sharing capability like AirDrop on Macbook.
2025,apple,Iphone 12,x,"The iPhone 12 design is comfortable to hold, but the refresh is not a big one."
2021,apple,Iphone 12,x,"iPhone 12 mini is just the iPhone 12 in a smaller body, potentially the cheapest iPhone of 2021."
2019,apple,Iphone 12,x,"The iPhone 12's camera is incredible, especially handheld at night the wide lens is super useful."
2025,apple,Iphone 12,x,The iPhone 12 offers little different as a mid-tier alternative to the Pro model iPhones.
2020,apple,Iphone 12,x,"Will post the full review for the iPhone 12 by evening, finalizing the points now."
2025,apple,Iphone 12,x,"I am looking at new features, battery life and performance in this review of iOS 18.3 update on iPhone 12 Pro"
2025,apple,Iphone 12,x,"I will review the iOS 18.3 update on iPhone 12 Mini, and look at the new features and the battery life."
2025,apple,Iphone 12,x,"iPhone 12 is still the best video phone, don't upgrade if you're a normal user with a 13 or 14 Pro."
2022,apple,Iphone 12,quora,I have the iPhone 12 Pro and it's extremely fast. The cameras are great and it feels very solid. I like the flat edges better on this model.
2020,apple,Iphone 12,quora,"I've had my iPhone 12 for eight months now and it is the first iPhone I've owned. Sadly, it's the most useless pile of garbage I've ever had."
2021,apple,Iphone 12,quora,"I recently got the iPhone 12 Pro Max a couple weeks after it got released. I love it, especially the cameras, which are very high quality."
2019,apple,Iphone 12,quora,The OLED display is amazing it's really accurate and not over saturated. I have squeezed seven hours of screen on time with this phone.
2019,apple,Iphone 12,quora,"The combination of the larger sensor, faster lens, improved stabilization, LIDAR, and processing power means that the iPhone 12 Pro Max is amazing."
2019,apple,Iphone 12,quora,"The new dual camera has 12 MP on both cameras. The upper camera can autofocus faster, the lower one can capture more of the scene."
2020,apple,Iphone 12,quora,"The iPhone 12 Pro Max is like an upscaled version of the iPhone 12 Pro, with a bigger display and battery and an improved camera setup."
2021,apple,Iphone 12,quora,"Apple didn't offer anything extraordinary with this new series, only marginal improvements from the iPhone 12. Some major highlights were noticed."
2019,apple,Iphone 12,quora,"The quality of the actual camera is very low, only 12 mp. However, the main issue is with the lenses. They're too wide for what is needed."
2020,apple,Iphone 12,reddit,"The 12 Pro Max camera is slightly better, but the difference is really small and I was hoping for a bigger jump."
2020,apple,Iphone 12,reddit,"I pre-ordered the iPhone 12 and this review bummed me out, but I'll still give it a shot with the bigger phone."
2020,apple,Iphone 12,reddit,The iPhone 12 camera seems to have more advantages in darker settings. This review seems phoned in.
2020,apple,Iphone 12,reddit,I'm switching from an X to a 12 mini because I'm not a heavy user and it will be perfect for me.
2020,apple,Iphone 12,reddit,These reviews validate my decision to upgrade to the mini because I have very small hands.
2020,apple,Iphone 12,reddit,I hope Apple keeps making smaller phones like the mini. I hope Samsung copies the idea.
2020,apple,Iphone 12,reddit,I stopped using big phones and the mini will be replacing my iPhone X. Finally an iPhone I wanted!
2020,apple,Iphone 12,reddit,"Switching to the mini will give me a bigger screen while reducing the physical size, a double win!"
2020,apple,Iphone 12,reddit,I can’t wait for the mini. A smaller screen is more efficient and this is my dream phone.
2020,apple,Iphone 12,reddit,This iPhone Mini is going to be a great screen upgrade for a correctly sized iPhone for me.
2020,apple,Iphone 12,reddit,"The 12 mini with a protective case is basically the same size as my old iPhone, but the screen is bigger!"
2021,apple,Iphone 12,reddit,I honestly love my 12 Pro Max. The modem and battery improvements alone were worth the upgrade for me.
2021,apple,Iphone 12,reddit,"I love my 12 Pro and I'm glad I didn't get the Max, the regular size is perfect for me."
2021,apple,Iphone 12,reddit,No 120Hz is still a big dealbreaker for me. I expect a high refresh rate for this price.
2021,apple,Iphone 12,reddit,I hope they fix the wireless charging issue with the iPhone 12 Pro. It only charges for a second.
2021,apple,Iphone 12,reddit,I have the 12 Pro Max and I absolutely love it. I am just wondering when it will brick.
2021,apple,Iphone 12,reddit,"I got my 12 Pro on launch day. Great phone, I only wish it had 120Hz refresh rate."
2021,apple,Iphone 12,reddit,My iPhone 12 sucks and was a waste of money. The camera doesn't focus and it lags a lot.
2021,apple,Iphone 12,reddit,I prefer the curved design of the 11. The 11 design with the thinner bezels would be perfect.
2021,apple,Iphone 12,reddit,"I am on a iPhone 12 and two things keep me here, superior hardware/support and better apps."
2021,apple,Iphone 12,reddit,"I have an iPhone 12 and a Pixel. I much prefer my iPhones. Faster, supported years longer."
2021,apple,Iphone 12,reddit,I went from iPhone 11 to pixel 5 and I disagree with everything you say. iOS is better.
2021,apple,Iphone 12,reddit,I switched to the 12 from Pixel and I really hated it for a while. Now I finally appreciate it.
2021,apple,Iphone 12,reddit,I moved to iphone 12 Pro Max for security and privacy and stayed for the camera and battery life.
2021,apple,Iphone 12,reddit,"I switched to Apple and regretting it, ended up selling it to my mother-in-law, disaster."
2021,apple,Iphone 12,reddit,Using my wife's iphone 12 is a chore. I prefer the scrolling on the Pixel. Pixel5 ftw
2021,apple,Iphone 12,reddit,"I compared the iPhone 12 with my pixel 4 and the Pixel is more fluid, overall I like iOS though."
2021,apple,Iphone 12,reddit,"I use iOS only if I have invested in an apple watch and some airpods, Pixel ALL the way."
2021,apple,Iphone 12,reddit,"The notifications management on Android is better, I find Android OS on Google Pixel more user friendly."
2021,apple,Iphone 12,reddit,I feel so limited with iOS. I always used Android. I have apps that helps me daily.
2021,apple,Iphone 12,reddit,I was an Android set my whole life up until about a week ago when I got an iPhone 13 mini.
2021,apple,Iphone 12,reddit,I am surprised you used FaceTime as much as you did! I came from Samsung and default to WhatsApp.
2021,apple,Iphone 12,reddit,I switched it an iPhone 11. I’m thinking of buy a note just to have another large phone with a stylus.
2021,apple,Iphone 12,reddit,I bought my wife the iPhone 13 Pro Max so I can use the phone for pics and dabble with iPhones.
2021,apple,Iphone 12,reddit,Love google pixel devices and iPhones. Currently on iPhone 13 Pro Max because ATT gave me money.
2021,apple,Iphone 12,reddit,"I’m from Myanmar and I can see myself as heavy Apple user since I got iPhone, Mac and Watch."
2021,apple,Iphone 12,reddit,"I'm at 86% battery health after owning the 12pro for 14 months, is this normal?"
2021,apple,Iphone 12,reddit,"The iPhone 12 has a brilliant camera, but some phone brands put too many cameras on the phone."
2021,apple,Iphone 12,reddit,"I took portrait pics with iPhone 12 and its yellowish always, not sure why this happens to the photos."
2021,apple,Iphone 13,x,"The iPhone 13 Pro has a better display, the best camera, and incredible battery life."
2023,apple,Iphone 13,x,The photo department is great and there is no heating. It's still the best video phone.
2025,apple,Iphone 13,x,The iPhone 13 Pro Max is the best iPhone ever.
2021,apple,Iphone 13,x,Buy the iPhone 13 Pro Max for the battery and keep it for the camera.
2021,apple,Iphone 13,x,Apple wasn't kidding about the new sensors on the iPhone 13. The 3x zoom with night mode enabled is great.
2022,apple,Iphone 13,x,The iPhone 13 battery life seems to be about the same or slightly better than the iPhone 13 lineup.
2021,apple,Iphone 13,quora,"The iPhone 13 is amazing in all aspects. The performance is better, photography is good, and battery backup is best for long run."
2021,apple,Iphone 13,quora,The iPhone 13 Pro Max does everything you could want from a smartphone. This premium flagship packs a 120Hz refresh rate.
2020,apple,Iphone 13,quora,"Reviewers have been largely impressed with the iPhone 13 Pro, and it has received mostly positive reviews."
2021,apple,Iphone 13,quora,"With a new display, a bigger battery, and better camera and software features, the iPhone 13 sets a new benchmark for large phones."
2023,apple,Iphone 13,quora,The iPhone 13 mini is definitely a very cute phone. It is better that you stay on the 13 as the size of the device is almost same.
2025,apple,Iphone 13,quora,"My 13 mini works perfectly fine so far, so I'll stick with it. It is way, way more smartphone than I need."
2022,apple,Iphone 13,quora,I just bought an IPHONE 13 pro max. Apple usually reduces the price of the old iPhone when it launches a new one.
2024,apple,Iphone 13,quora,I prefer 6.1” iPhones compared to the monster 6.7” iPhone 13 Pro Max which is too bulky. I bought the smaller size.
2021,apple,Iphone 13,reddit,"The battery life is unbelievable, easily getting two full days with heavy use. It's crazy with the higher refresh rate and 5G."
2021,apple,Iphone 13,reddit,"I'm really impressed with the iPhone 13 Pro Max battery. Even with heavy use, it lasts all day."
2021,apple,Iphone 13,reddit,"As a Samsung user, I'm jealous of the iPhone 13 battery life. My secondary iPhone 13 lasts so much longer."
2021,apple,Iphone 13,reddit,Upgrading from my XS Max to the 13 Pro Max is a dream. The battery life is a game changer.
2021,apple,Iphone 13,reddit,"The battery is great, but the phone's size is inconvenient. The regular Pro is more portable and lasts long enough."
2021,apple,Iphone 13,reddit,I forgot to charge my 13 Pro Max and it lasted three days with heavy use. The battery is amazing!
2021,apple,Iphone 13,reddit,"My 12 Pro battery sucks. I'm tempted to upgrade for the battery, cameras, and smaller notch."
2021,apple,Iphone 13,reddit,The battery on my iPhone 13 is miles ahead of my 12 Pro Max. The 11 Pro Max had the best battery.
2021,apple,Iphone 13,reddit,I'm impressed with the battery life compared to my S21 Ultra. The iPhone 13 Pro Max holds a charge!
2021,apple,Iphone 13,reddit,The battery life is ridiculously good. I can easily get 3-4 days of use.
2021,apple,Iphone 13,reddit,I'm shocked I get a full day without charging. The 12 Pro Max always needed a battery pack.
2021,apple,Iphone 13,reddit,The best thing about this phone is the battery life. I can go a day without worrying about it.
2021,apple,Iphone 13,reddit,This iPhone 13 is all about refinement. Slight but nice and welcomed improvements all around.
2021,apple,Iphone 13,reddit,I'm tempted to upgrade for the camera and battery. Best Buy's trade-in offer is quite good.
2021,apple,Iphone 13,reddit,"I'm running an iPhone 8 and was going to go for the 13 mini, but the Pro cameras are tempting."
2021,apple,Iphone 13,reddit,The 13 Pro is everything I wanted in the 12 Pro. I'm upgrading and passing the 12 Pro to family.
2021,apple,Iphone 13,reddit,"I have a 12 Pro Max, so I'll pass on this one. It's a great upgrade for those looking."
2021,apple,Iphone 13,reddit,I'm excited for the macro camera. The automatic switching is weird and needs an off switch.
2021,apple,Iphone 13,reddit,I don't understand people who say this phone is the same as last year's. It's an incremental upgrade.
2021,apple,Iphone 13,reddit,The 11 hours of screen on time is life changing. I struggle to kill it on my day off.
2021,apple,Iphone 13,reddit,The battery life is astonishing. I was practically tethered to a power cord with my iPhone X.
2021,apple,Iphone 13,reddit,I'm using a Samsung S10 plus and I'm interested in the iPhone 13 for the better battery life.
2021,apple,Iphone 13,reddit,My 11 Pro Max battery is degrading. Good to know the replacement will be exactly what I need.
2021,apple,Iphone 13,reddit,I got 32 hours of casual use. Amazing performance and great to not have to top up during the day.
2021,apple,Iphone 13,reddit,"This is amazing battery life. I haven't been able to stretch it, since i do WFH these days."
2021,apple,Iphone 13,reddit,The 13 mini feels so good holding it in one hand. I find the Pro Max to be too big.
2021,apple,Iphone 13,reddit,"The 120Hz screen is like a great bass player. Some might not notice, but everyone notices when its gone."
2021,apple,Iphone 13,reddit,I love the iPhone 13 but I miss 3D Touch. The haptic engine feels substantially weaker too.
2021,apple,Iphone 13,reddit,Upgrading from my iPhone 12 Pro to a 13 pro for $100. The battery is amazing!
2021,apple,Iphone 13,reddit,"Coming from XR I see a massive improvement. Phone lasts all day after gaming, browsing web, texting nonstop."
2021,apple,Iphone 13,reddit,"I upgraded from a iPhone 7 Plus, and the difference is huge, The fluidity, how insanely long the battery lasts."
2021,apple,Iphone 13,reddit,"I cannot believe the extraordinary battery life of the IPhone 13, upgrading from my 12 Pro Max soon."
2021,apple,Iphone 13,reddit,The iPhone 13 can be heavy. Recommend 256gb for 4k ProRes. Screen is smooth and battery life is great.
2021,apple,Iphone 13,reddit,"This phone is truly amazing, even coming from a 12 Pro Max. Macro mode, Promotion, and battery life is insane."
2021,apple,Iphone 13,reddit,I am on the iPhone XS. I am not sure if upgrading to the iPhone 13 is worth it.
2021,apple,Iphone 13,reddit,Switched from Oneplus 7 to iPhone 13 mini for the form factor and cameras. Love the experience.
2021,apple,Iphone 13,reddit,"Just upgraded my SE to the 13 mini. I’m loving it so far. As long as Apple makes mini phones, I’ll buy them."
2021,apple,Iphone 13,reddit,I really like the size and aesthetics of the iPhone 13 in black. I like bigger phones too.
2021,apple,Iphone 13,reddit,I have been using the IPhone 13 mini for 5 days. This phone impresses me visually. It is perfect!
2021,apple,Iphone 13,reddit,I wish I could adjust to the mini. The compromises in battery and screen are not justified.
2021,apple,Iphone 13,reddit,Went from og SE to mini 13 and it’s been amazing. I miss the home button and the headphone jack
2021,apple,Iphone 13,reddit,This isn’t for those of you on the 12. This is for those who have older phones like me.
2021,apple,Iphone 13,reddit,"I'm upgrading from an XR to the 6.1"" 13. For me it's perfect for me in every way."
2021,apple,Iphone 13,reddit,If you have an 11 or 12 this phone is just not for you but for ppl with older phones than that.
2021,apple,Iphone 13,reddit,Decided 13 was adequate for my needs. The photos are nearly indistinguishable and the lighter weight is nice.
2022,apple,Iphone 14,x,"The regular iPhone 14 barely feels like an upgrade, you should consider upgrading to the pro version. I would recommend you to Go Pro or Go Home."
2023,apple,Iphone 14,x,"If you're a normal user with the 13 or 14 Pro, there is not much difference. The phone is still the best video phone and doesn't have any heating issues."
2024,apple,Iphone 14,x,I upgraded from a 14 pro that I got two years ago. I got the 16 pro white with 512g and I think it's a pretty good phone overall.
2025,apple,Iphone 14,x,I bought an iPhone 14pro in May and I realized much later that my phone's camera quality and display doesn't match with other iPhone 14 pro.
2025,apple,Iphone 14,x,"Some prefer the iPhone 14 Pro for balance when looking at battery life and video features, I would highly recommend this phone."
2023,apple,Iphone 14,x,"After watching a few iPhone 15 reviews, I can tell that the camera on the iPhone 15 is generally better than the iPhone 14 Pro."
2023,apple,Iphone 14,x,"The experience is miles better on iOS, specifically the iPhone 14 Pro Max. I have played both these games for endless hours on both platforms."
2025,apple,Iphone 14,x,The iPhone 14 Pro Max has great battery life and the battery can last all day. I ended the day with 37% battery remaining after 5 hours of use.
2021,apple,Iphone 14,quora,The iPhone 14 Pro Max is an excellent smartphone with cutting-edge features. I would recommend it if you're looking for a high-powered phone.
2022,apple,Iphone 14,quora,"It's absolutely garbage for gaming. The phone is heavy, and when something is wrong with apps you downloaded from the Apple Store, you can't review it."
2024,apple,Iphone 14,quora,I am typing this with this garbage sorry for the harsh words.
2022,apple,Iphone 14,quora,I am typing this with this garbage sorry for the harsh words. The only pro is that you can show off.
2023,apple,Iphone 14,quora,"It's absolutely garbage for gaming. The phone is heavy, and when something is wrong with apps you downloaded from the Apple Store, you can't review it."
2019,apple,Iphone 14,quora,The iPhone 14 Pro Max is an excellent smartphone with cutting-edge features. I would recommend it if you're looking for a high-powered phone.
2023,apple,Iphone 14,quora,"There is NO DIFFERENCE between the iPhone 13 and iPhone 14. The display, camera, battery, CPU, charging, external design are all identical."
2024,apple,Iphone 14,quora,"It's absolutely garbage for gaming. The phone is heavy, and when something is wrong with apps you downloaded from the Apple Store, you can't review it."
2020,apple,Iphone 14,quora,The iPhone 14 Pro Max is an excellent smartphone with cutting-edge features. I would recommend it if you're looking for a high-powered phone.
2022,apple,Iphone 14,quora,"It's absolutely garbage for gaming. The phone is heavy, and when something is wrong with apps you downloaded from the Apple Store, you can't review it."
2023,apple,Iphone 14,quora,"It's absolutely garbage for gaming. The phone is heavy, and when something is wrong with apps you downloaded from the Apple Store, you can't review it."
2025,apple,Iphone 14,reddit,I use my iPhone 14+ for basic tasks. The calendar and contacts transfer was faulty from my Samsung. I'll use it until it dies.
