year,company,product,source,content
2025,google,Pixel Buds A-Series,x,The Google Pixel Buds 2a are better with ANC due to being affordable earbuds.
2024,google,Pixel Buds A-Series,x,The Pixel Buds A-Series adds extra value to their purchase in my opinion.
2025,google,Pixel Buds A-Series,x,I've been waiting for Gemini Live in the Pixel Buds Pro 2 for so long.
2025,google,Pixel Buds A-Series,x,"I'll throw in a pair of Pixel Buds because why not, they are great."
2025,google,Pixel Buds A-Series,x,"The Pixel Buds Pro 2 is a huge new update from Google, pretty amazing."
2025,google,Pixel Buds A-Series,x,"They offer excellent sound quality and are easy to use, really great."
2025,google,Pixel Buds A-Series,x,"Patiently waiting for my pixel to arrive, I would return these buds."
2020,google,Pixel Buds A-Series,x,I have selected pixel buds 2020 setting that gives a great audio output.
2021,google,Pixel Buds A-Series,quora,"I think the Nuraphones have good sound by the reviews, but they're not noise cancelling."
2019,google,Pixel Buds A-Series,quora,"Pixel Buds A-Series is cheerful in its execution, making it enjoyable to use."
2019,google,Pixel Buds A-Series,quora,"The earpieces are larger than the Google Pixel Buds A-series, which may affect comfort."
2024,google,Pixel Buds A-Series,quora,"Pixel Buds A-Series is cheerful in its execution, offering a positive user experience."
2017,google,Pixel Buds A-Series,quora,The Google Pixel Buds A-Series has a unique design with lightweight earbuds.
2023,google,Pixel Buds A-Series,quora,"Pixel Buds A-Series is cheerful in its execution, providing a pleasant experience."
2022,google,Pixel Buds A-Series,reddit,I'm curious if anyone can hear what I'm listening to while wearing them.
2022,google,Pixel Buds A-Series,reddit,Stems are overlooked on wireless earbuds. I wish my Galaxy Buds had them.
2022,google,Pixel Buds A-Series,reddit,I think these earbuds will only last three months. Google won't help with repairs.
2022,google,Pixel Buds A-Series,reddit,Do these leak sound? I returned my Pixel Buds because they leaked too much.
2022,google,Pixel Buds A-Series,reddit,I just got mine and I miss the ear wings because they aren't secure.
2022,google,Pixel Buds A-Series,reddit,"I have low volume for phone calls. The media sounds loud, anyone else have that?"
2022,google,Pixel Buds A-Series,reddit,"I wish I could use the case magnets to secure it. Otherwise, I am enjoying the Pros."
2022,google,Pixel Buds A-Series,reddit,"I can't get a good fit. My ears are too small, I might return them."
2022,google,Pixel Buds A-Series,reddit,The Ars Technica review left out the cons. ANC isn't good and audio quality lacks.
2022,google,Pixel Buds A-Series,reddit,I can't wear them because Google ditched the wings. My A-series stay in well.
2022,google,Pixel Buds A-Series,reddit,"The large tips passed the fit test, but they loosen on the bike. Need better tips."
2022,google,Pixel Buds A-Series,reddit,"Call quality is just ok, not great. Curious to hear more about that from users."
2022,google,Pixel Buds A-Series,reddit,"I love my Airpod pros. I never have issues with them, unlike these earbuds."
2022,google,Pixel Buds A-Series,reddit,I am waiting for them to go on sale around Christmas time.
2022,google,Pixel Buds A-Series,reddit,I find the ear tips hurt. The sound is muddy. The A series sound better.
2022,google,Pixel Buds A-Series,reddit,I had to switch to the smallest tip. They feel like they aren't secure.
2023,google,Pixel Buds A-Series,reddit,These are garbage because they come loose constantly and the touch function sucks.
2025,google,Pixel Buds A-Series,reddit,"I was planning to buy this and will absolutely will buy this, I don't like base."
2024,google,Pixel Buds A-Series,reddit,"The downsides outweigh the advantages, especially longevity. I won't buy them again."
2024,google,Pixel Buds A-Series,reddit,"They are significantly more comfortable than the silicone tips, which is a game changer!"
2024,google,Pixel Buds A-Series,reddit,I agree mostly. I could not get them to fit properly with the silicone tips.
2024,google,Pixel Buds A-Series,reddit,ANC does not work for me. There is no difference when it's turned on.
2025,google,Pixel Buds A-Series,reddit,I avoid earbuds with a stem. They look ridiculous and I hate them.
2021,google,Pixel Buds A-Series,reddit,"My pixel buds have a good connection. Sound is clear, but a little quiet."
2021,google,Pixel Buds A-Series,reddit,"They're comfortable but not loud enough. If your volume slider is below 50%, they're inaudible."
2021,google,Pixel Buds A-Series,reddit,"They were a pleasant surprise, better than my work Air Pods. Great sound."
2021,google,Pixel Buds A-Series,reddit,"They are fantastic with my 2XL. No disconnection issues, and extremely comfortable."
2021,google,Pixel Buds A-Series,reddit,"They work great, and have good volume and sound for my ears. Great upgrade."
2021,google,Pixel Buds A-Series,reddit,"Super quiet and slow to connect lol, but connected to my Pixel 6 Pro and 100000x better."
2021,google,Pixel Buds A-Series,reddit,"They're literally Google airpods, with decent audio and durability, and connectivity issues."
2021,google,Pixel Buds A-Series,reddit,They hurt after a while. AirPods Pros are much more comfortable for me.
2021,google,Pixel Buds A-Series,reddit,"The Bluetooth range is superior to Samsung's buds, which constantly disconnect in my pocket."
2021,google,Pixel Buds A-Series,reddit,I enjoy mine and find that I can rest comfortably with them in at night.
2021,google,Pixel Buds A-Series,reddit,"They sound fantastic and fit comfortably. Amazing, like a Home mini in my ear."
2021,google,Pixel Buds A-Series,reddit,I love mine. The only issue I have is the color options which aren't great.
2021,google,Pixel Buds A-Series,reddit,I love them (using with a Pixel 4a). They just work well and simply.
2024,google,Pixel Buds A-Series,reddit,I use mine at the gym and they're great. The call quality seems good too.
2024,google,Pixel Buds A-Series,reddit,They seem to let in a lot of noise and don't get a good seal in my ears.
2024,google,Pixel Buds A-Series,reddit,"Buds pro tend to fall out, but the audio quality is great, but a series stays in."
2024,google,Pixel Buds A-Series,reddit,The pixel bud don't stay in my ears. I use a pair of cheap first gen airpods.
2024,google,Pixel Buds A-Series,reddit,My A series buds stay in much better for me when out jogging because of the wings.
2022,google,Pixel Buds A-Series,reddit,The pressure inside the ear canal on both buds? And how is long term comfort?
2021,google,Pixel Buds A-Series,reddit,How in the world can they launch these with the same static hissing noise?
2025,google,Pixel Buds,x,"The Pixel Buds 2a are a worthy upgrade, with ANC making them a great choice for your ears."
2020,google,Pixel Buds,x,The Google Pixel Buds are way better than I expected. The sound quality is amazing!
2025,google,Pixel Buds,x,"The Google Pixel Buds 2a are a better value, but nothing mind-blowing stood out to me."
2025,google,Pixel Buds,x,"The Google Pixel Buds 2a are diet Pixel Buds at a palatable price, which is a win."
2025,google,Pixel Buds,x,"The Google Pixel Buds 2a price isn't right, it is overpriced for what it offers."
2025,google,Pixel Buds,x,"The Google Pixel Buds 2a are the Pixel 10 of headphones, a fantastic evolution."
2020,google,Pixel Buds,x,"I was deciding between the Pixel Buds and Galaxy Buds, but I went with the Pixel Buds."
2025,google,Pixel Buds,x,"The Google Pixel Buds 2a are the Pixel 10 of headphones, great product overall."
2024,google,Pixel Buds,x,The Google Pixel Buds Pro 2 are a very good product. I recommend it to others.
2025,google,Pixel Buds,x,"The Google Pixel Buds 2A are the right kind of compromise, very reliable."
2025,google,Pixel Buds,x,The Pixel Buds Pro sound so much better than I anticipated. They are super easy to use.
2025,google,Pixel Buds,x,Wearing the Pixel Buds at work has been a great experience. Access to music is great.
2023,google,Pixel Buds,x,"The Pixel Buds A-Series are simple, affordable buds for Android phones, pretty reliable."
2025,google,Pixel Buds,x,The Pixel Buds Pro 2 is easily Google's greatest hardware product of the year. I love it.
2025,google,Pixel Buds,x,The Google Pixel Buds 2a are affordable earbuds that are better with ANC. Great stuff!
2025,google,Pixel Buds,x,"After two weeks with the Google Pixel Buds 2a, I recommend upgrading to these wireless earbuds."
2025,google,Pixel Buds,x,"The Google Pixel Buds 2A are a sound choice for Pixel users, giving a good deal."
2025,google,Pixel Buds,x,"The Bluetooth Google Pixel Buds are Google's own version of the Apple Airpods, very competitive."
2025,google,Pixel Buds,x,"The Google Pixel Buds 2a are among the most thoughtfully made earbuds out there, so worth it!"
2024,google,Pixel Buds,x,The Google Pixel Buds Pro 2 earbuds carry a hefty price tag. But they are worth it!
2025,google,Pixel Buds,x,"The Google Pixel Buds 2a are great. I tested them, and they'll work good."
2025,google,Pixel Buds,x,"The Google Pixel Buds review shows that it's all about AI, and there's little in sound quality."
2020,google,Pixel Buds,x,"The Google Pixel Buds review: second time's the charm, now they are working as intended."
2025,google,Pixel Buds,x,"Our Pixel Buds 2a Review shows Google's Best Earbud Experience For Less, great product."
2025,google,Pixel Buds,x,The Pixel Buds 2a Review is awesome. Google's Best Earbud Experience For Less is amazing.
2025,google,Pixel Buds,x,The Gemini Live in the Pixel Buds Pro 2 is the AI audio integration I've been waiting for.
2025,google,Pixel Buds,x,"The Pixel Buds 2a review shows that the new earphones tick a lot of crucial boxes, especially for Pixel owners."
2025,google,Pixel Buds,x,I tried Gemini on the Pixel Buds Pro 2 and can confirm that it's so human and useful.
2025,google,Pixel Buds,x,"The Pixel Buds 2a Review is mixed, the Pixel 10 of Earbuds has some major flaws."
2025,google,Pixel Buds,x,The Pixel Buds 2A are an alternative to AirPods for Android. But are they the best?
2024,google,Pixel Buds,x,"The Google Pixel Buds 2A add extra value to their purchase, with overall good performance."
2020,google,Pixel Buds,x,The Google Pixel Buds 5 and Pixel Buds Official Full Unboxing | WOW are a huge shout out!
2019,google,Pixel Buds,quora,"I find these buds very satisfying, my honest review. They are great for everyday use and I enjoy the sound quality."
2020,google,Pixel Buds,quora,"They're pretty good overall, amazing because of the technology in them, pretty good sound and sleek design."
2020,google,Pixel Buds,quora,"They're pretty good overall, amazing because of the technology in them, pretty good sound and sleek design."
2019,google,Pixel Buds,quora,"I find these buds very satisfying, my honest review. Pixel buds 2 also have touch controls for adjusting volume."
2023,google,Pixel Buds,quora,Honestly one of the best earbuds! The clarity and noise cancellation is amazing. Good battery life!
2020,google,Pixel Buds,quora,"They're pretty good overall, amazing because of the technology in them, pretty good sound and sleek design."
2020,google,Pixel Buds,quora,"I always had the feeling that the earbud would fall off my ear. The left ear bud has issues, I had to push it back."
2017,google,Pixel Buds,reddit,Removing the port made me switch from Pixel to Samsung. It's a real problem.
2017,google,Pixel Buds,reddit,Google should have kept the headphone jack or made an adapter sleeve.
2017,google,Pixel Buds,reddit,Sound quality is average. Call quality and assistant are the only good things.
2017,google,Pixel Buds,reddit,AirPods exceeded my expectations. Google should be able to make a good product.
2017,google,Pixel Buds,reddit,Bluetooth is terrible. Every product I've used with it is awful 90% of the time.
2017,google,Pixel Buds,reddit,I'd rather buy Shure earbuds and use a phone with a headphone jack.
2017,google,Pixel Buds,reddit,Google has great ideas but fails to execute them well with the Pixel Buds.
2017,google,Pixel Buds,reddit,The bass is underwhelming and the battery life is also pretty weak.
2017,google,Pixel Buds,reddit,The Pixel 2 feels like it has a permanent case. The screen doesn't look nice.
2017,google,Pixel Buds,reddit,How do flawed products get made? Don't they test their own stuff?
2017,google,Pixel Buds,reddit,"No audio specs for an audio product? Marketed for Google fans, not music lovers."
2017,google,Pixel Buds,reddit,Earbuds can damage your hearing. Over-ear headphones sound better and are safer.
2017,google,Pixel Buds,reddit,I want these because it's hard to find wireless earbuds that fit like these.
2017,google,Pixel Buds,reddit,Google should make earbuds with a 3.5mm plug and sell them for under $10.
2020,google,Pixel Buds,reddit,I can't wear push-in style buds. I prefer the solid type like old iPhone headphones.
2020,google,Pixel Buds,reddit,The Pixel Buds reviews are looking good. I'll buy them during the holidays.
2020,google,Pixel Buds,reddit,"I want them, maybe when my Jabras die, I will buy the Pixel Buds."
2024,google,Pixel Buds,reddit,The biggest improvement is comfort and transparency mode. Transparency is a 9/10 now.
2024,google,Pixel Buds,reddit,"Transparency mode is the best feature. ANC seems solid, and sound is marginally better."
2024,google,Pixel Buds,reddit,The transparency mode is incredible. It outdoes Pixel Bud Pros 1 and XM5 buds.
2024,google,Pixel Buds,reddit,"I love the transparency mode, but Gemini isn't fully ready yet, sadly."
2024,google,Pixel Buds,reddit,Can you wear them to sleep comfortably? I need something for brown noise.
2024,google,Pixel Buds,reddit,"The Pixel Buds Pro 2 fit is better, and they now respond to touch with gloves on."
2024,google,Pixel Buds,reddit,These are my first ANC earbuds and they're magic. Transparency mode is annoying with wind.
2024,google,Pixel Buds,reddit,"The ear tips were too small, so I replaced them with Beats Fit Pro tips. It's perfect now."
2024,google,Pixel Buds,reddit,I wish they had physical buttons instead of touch ones for running. This is my only gripe.
2024,google,Pixel Buds,reddit,How is the microphone quality? Is it improved for noisy environments like cafes?
2024,google,Pixel Buds,reddit,"I dropped one in a pool, retrieved it, and it still works. Very impressed with it."
2025,google,Pixel Buds,reddit,Are they reliable? My Pixel Buds Pro are becoming less reliable with sweat now.
2024,google,Pixel Buds,reddit,I've had the opposite experience with microphones. They sound like complete garbage.
2024,google,Pixel Buds,reddit,I got mine yesterday and they are awesome. They really fixed the size and fit.
2024,google,Pixel Buds,reddit,I had to move to small tips and it seems better. It is a huge improvement now.
2024,google,Pixel Buds,reddit,I retired my AirPods Pro for the Pixel Buds Pro because of the multipoint switching.
2024,google,Pixel Buds,reddit,"With the store credit, I might have to upgrade to these new Pixel Buds lol."
2024,google,Pixel Buds,reddit,How are these compared to the Galaxy Buds2 Pro? Are there any major differences?
2024,google,Pixel Buds,reddit,"I love my PBP, but hate the fit. Is the fit better on the Pixel Buds Pro 2?"
2024,google,Pixel Buds,reddit,"The old ones would never fit, would the new ones fit better and stay in my ears?"
2024,google,Pixel Buds,reddit,I've never been a fan of earbuds so I'm hoping these may change my mind.
2024,google,Pixel Buds,reddit,"I love them at the moment, but the white case gets dirty so easily."
2024,google,Pixel Buds,reddit,"I'm disappointed by the ANC. Comfort is better, but isolation isn't great in cafes."
2024,google,Pixel Buds,reddit,Sold. I'll be getting the newer ones when my old ones break. I'd like your thoughts on the new Pixel.
2024,google,Pixel Buds,reddit,I'm having the opposite experience with transparency mode. There's a solid white noise.
2024,google,Pixel Buds,reddit,Can I change the touch functions? Skipping 30 seconds would be very useful for me.
2024,google,Pixel Buds,reddit,How much better is the sound quality compared to the 1s? I hated the sound on those.
2024,google,Pixel Buds,reddit,"After 3 weeks, I will send them back. Poor quality sound, and bad customer service."
2020,google,Pixel Buds,reddit,"I can't find earbuds that stay in my ears comfortably, no matter what I try."
2020,google,Pixel Buds,reddit,I'm in love with my pair. I didn't hesitate to buy them and I have no regrets.
2020,google,Pixel Buds,reddit,"I love every bit of them. They feel great, sound great, and work perfectly fine."
2020,google,Pixel Buds,reddit,I got mine a few days ago and I love them. The sound quality is outstanding.
2020,google,Pixel Buds,reddit,Comfort is subjective for earbuds. Everyone's ear is different for the pixel buds.
2020,google,Pixel Buds,reddit,Can you wear them against a pillow comfortably? My Jaybirds hurt my head.
2022,google,Pixel Buds,reddit,Great that they fixed the material issues from the Galaxy Buds Pro on these new ones.
2022,google,Pixel Buds,reddit,"Opinion is split on the sound quality, some love them, others not so much."
2022,google,Pixel Buds,reddit,The fact that the Pixel stuff is positive gives me hope for the Pixel phones.
2022,google,Pixel Buds,reddit,"I've had mine for almost a month, they are incredible earbuds, and I recommend them."
2022,google,Pixel Buds,reddit,"I wish they stopped calling IEMs earbuds, it is harder to look for actual earbuds."
2022,google,Pixel Buds,reddit,They fell off easily and the sound quality wasn't great. I prefer the Anker ones.
2020,google,Pixel Buds,reddit,Got mine today and they're awesome. I feel they are better than my AirPods.
2020,google,Pixel Buds,reddit,Received mine yesterday and love them. They are comfortable and stay in my ears.
2020,google,Pixel Buds,reddit,"I'm tempted to switch to the Pixel Buds, but I'll wait for long-term reviews."
2025,google,Pixel Fold,x,"I am impressed with the Pixel Fold so far, even if it feels like a minor update."
2025,google,Pixel Fold,x,The Pixel Fold is shockingly good! I'm delighted by this thing it's refreshing to use.
2024,google,Pixel Fold,x,"Not just with the original Pixel Fold, but also with a few of the alternatives. It's a phone for everyone."
2025,google,Pixel Fold,x,"The Pixel Fold is brighter, faster and sturdier, but it comes with a premium price."
2025,google,Pixel Fold,x,Is the latest foldable Pixel Fold worth the premium price? It is a more durable foldable.
2024,google,Pixel Fold,x,"The Pixel Fold is so much better than the first one, but is that enough?"
2025,google,Pixel Fold,x,"The Pixel Fold is a big step into the unknown for Google, but it's unexpectedly amazing!"
2024,google,Pixel Fold,x,"My video review of the Pixel Fold will take some time, hopefully sometime next week, because it looks great."
2025,google,Pixel Fold,x,The Pixel Fold is hinging on innovation and is the ultimate Google phone.
2025,google,Pixel Fold,x,"The Pixel Fold has a familiar feel, but with smarter execution in its design."
2024,google,Pixel Fold,x,The Pixel Fold is in great shape and is my favorite flawed foldable.
2025,google,Pixel Fold,x,The Pixel Fold is a bit hard to recommend unless innovation is a priority.
2025,google,Pixel Fold,x,"The Pixel Fold gets it right, mostly, as an AI-powered foldable."
2025,google,Pixel Fold,x,"I want a Pixel Fold and Pixel Watch review, I am curious about the product."
2023,google,Pixel Fold,x,The Casetify Pixel Fold case review shows the cases are adding some much needed protection.
2025,google,Pixel Fold,x,"The Pixel Fold is unexpectedly amazing, but you can hate it based on your needs."
2025,google,Pixel Fold,x,The Pixel Fold review shows that durability and battery win out over sleekness.
2025,google,Pixel Fold,x,"I had some impressions when using the Pixel Fold, it's great with the Google's foldable design."
2025,google,Pixel Fold,x,"The Pixel Fold doesn't fear dust, it's a very resistant and well built foldable."
2024,google,Pixel Fold,x,"The Pixel Fold excels in design, but it falters in software compared to other foldables."
2025,google,Pixel Fold,x,I want the review on the Pixel Fold to understand it's pros and cons before buying.
2025,google,Pixel Fold,x,"The Pixel Fold is a familiar package with AI, a good software leap and responsive screen transitions."
2024,google,Pixel Fold,quora,The Pixel Fold is a first-generation product. It's new in the mobile market.
2022,google,Pixel Fold,quora,I have found the worst mobile I have ever used in my life. Samsung has no R&D and poor quality hardware.
2019,google,Pixel Fold,quora,I should prefer Pixel Fold instead of Samsung foldables because I can't use glass on a folding phone.
2025,google,Pixel Fold,quora,"Google's Pixel Fold is nice, but the wide outer screen still feels off. Overall, it's good but has its place."
2023,google,Pixel Fold,quora,The Pixel Fold was late and Pixel got Periscope zoom later. Google Pixel is the next big thing in the market.
2025,google,Pixel Fold,quora,"Pixel Fold's concept is interesting, but Samsung's execution is better. Reviews say the same about Flip7."
2025,google,Pixel Fold,reddit,"I hate the size of the Pixel Fold, it's too chunky and heavy. Otherwise, I think it's a cool device."
2025,google,Pixel Fold,reddit,I'm enjoying my new foldable phone. Pressing on the frame helps avoid putting pressure on the screen when closing it.
2025,google,Pixel Fold,reddit,"I like the Pixel Fold a lot, but it's delicate. Mine shattered after a small drop, but I love it otherwise."
2025,google,Pixel Fold,reddit,"My Fold charged slowly at first, but the charging speed seems faster after a month of use."
2025,google,Pixel Fold,reddit,"I just got the Pixel Fold, and I don't think I'll ever go back to a normal phone. It feels amazing."
2025,google,Pixel Fold,reddit,I can't list Samsung software as a pro. It's the reason I can't use their phones for long.
2025,google,Pixel Fold,reddit,I'm switching to the Pixel Fold if it doesn't have that annoying new update that looks like an Apple product.
2025,google,Pixel Fold,reddit,"My Pixel Fold's hinge mechanism is acting differently. It snaps when I open it, which feels strange."
2025,google,Pixel Fold,reddit,I love my Pixel Fold and I'm using it caseless with a glow in the dark skin and a magsafe ring.
2025,google,Pixel Fold,reddit,"I have the same color Pixel Fold with a cover and an anti-reflective protective glass, which is exceptional."
2025,google,Pixel Fold,reddit,I was looking to be deinfluenced. I have an S24 ultra and the specs seem the same.
2023,google,Pixel Fold,reddit,I think Google's current implementation of the side fingerprint reader is smart and convenient to use.
2023,google,Pixel Fold,reddit,Grab the Samsung it's a tablet. The reviewer is way wrong about the Pixel Fold durability.
2025,google,Pixel Fold,reddit,The Pixel Fold's cost versus the Fold 7 isn't a good match in terms of deals in my opinion.
2025,google,Pixel Fold,reddit,"The camera looks terrible, so I don't feel so bad about cancelling my order. I'll wait for P11 Fold."
2025,google,Pixel Fold,reddit,I tried out the Pixel Fold and couldn't find a reason to need such a big screen for my usage.
2025,google,Pixel Fold,reddit,I owned the Pixel 9 Pro Fold and Z Fold 5. The Pixel felt like a prototype Samsung is the Apple.
2025,google,Pixel Fold,reddit,Samsung's OS is complete garbage. Google's OS is far superior and stays out of my way.
2023,google,Pixel Fold,reddit,I am waiting for comments on the thermals of the Pixel Fold and will wait for more reviews.
2023,google,Pixel Fold,reddit,MKBHD's review was strange. He seemed disappointed even when talking about the phone's strengths.
2023,google,Pixel Fold,reddit,"My ZF4 started not unfolding flat after a few months. Since the Pixel Fold has no stylus, it's not an issue."
2023,google,Pixel Fold,reddit,"It seems like a great first attempt, but I can't get over the worse cameras and terrible battery."
2023,google,Pixel Fold,reddit,The battery life is a no-go for me. I wish Google used Snapdragon chips for efficiency.
2023,google,Pixel Fold,reddit,"Thankfully I didn't preorder, I like pixels for software, camera and cheap price so maybe next year."
2023,google,Pixel Fold,reddit,"Battery life is a pain point. Tensor G2 has got to go, and G3 needs hefty efficiency gains."
2023,google,Pixel Fold,reddit,"He really likes the Pixel Fold. He likes the pros and the quirks, and it kind of fits that Pixel vibe."
2023,google,Pixel Fold,reddit,These folding phones always look clunky and unrefined. I think we need another 3-5 years to get them right.
2023,google,Pixel Fold,reddit,"I'd rather get the 7 Pro and Pixel Tablet for YouTube, Reddit, and editing, instead of the Pixel Fold."
2023,google,Pixel Fold,reddit,"When I found out it was powered by the G2, I lost interest. Wait until next year for a better processor."
2023,google,Pixel Fold,reddit,I figured the battery life would suck because the Tensor ship is terrible with battery usage.
2023,google,Pixel Fold,reddit,The Pixel Fold should have come out 3 years ago. It doesn't learn from other manufacturers mistakes.
2023,google,Pixel Fold,reddit,"No desktop mode, poor battery, double screen not optimized, mid-range CPU, large bezel. Samsung Fold better."
2025,google,Pixel Fold,reddit,"The reviewer said he'll keep using this one though, which is an interesting way to end the review."
2025,google,Pixel Fold,reddit,What is not compatible or missing on the Google Pixel Pro Fold? The video doesn't provide details.
2025,google,Pixel Fold,reddit,Those bezels are still pretty horrendous. I have a feeling Jerry Rig will get dust in it instantly.
2025,google,Pixel Fold,reddit,"I switched to Android to get access to the latest AI experiments, and I love my first fold."
2025,google,Pixel Fold,reddit,The P9PF is my 1st Pixel after being a Samsung user for over a decade. Biggest pro is getting updates first.
