year,content,source
2022,"The Asus TUF RTX 3090 Ti makes a noise that sounds like it's in a lot of pain, according to a review.",x
2020,"The Nvidia GeForce RTX 3090 delivers playable 8K gaming performance, making it the most powerful graphics card.",quora
2020,"The 3090 is the most powerful GPU ever, even more powerful than...",quora
2021,The GeForce RTX 3090 is a high-end consumer GPU.,quora
2020,You will see a performance increase over the RTX 3080 if you have a fast CPU.,quora
2020,The RTX 3090 is the best and most powerful graphics card.,quora
2022,"Unfortunately, the NVIDIA RTX 3090 is not ideal for 1080p high-refresh gaming.",quora
2021,"Nvidia is abusing the situation. If you are lucky enough to have a 3080, keep it!",quora
2021,"GeForce RTX 3090Ti is a beast of a machine, the best graphics card ever!",quora
2020,The 3090 offers a 10-15% gaming uplift over the 3080. It's better for professional workloads.,reddit
2020,"It gets 30fps for 8k gaming, peaks over 400W, and costs twice as much as the 3080.",reddit
