year,content,source
2025,Employees received VR headsets and logged in to a virtual office space to have meetings. If I remember correctly it was Horizon Workrooms or ...,quora
2015,If Bob stepped into the workroom and saw that not much work was ... Make an appointment to review this situation. Take notes. If I was ...,quora
2022,... reviews along with VR news. You may start to make Money ... Horizon Workrooms. This platform isn't called workrooms for no reason ...,quora
2022,Merger Review | Federal Trade Commission. Probably not. They could ... Horizon Workrooms. This could also be a privacy nightmare—Haugen ...,quora
2022,metaverse is sure to receive very mixed reviews when it is finally released. ... Horizon. Upvote ·. 91.,quora
2017,Employees received VR headsets and logged in to a virtual office space to have meetings. If I remember correctly it was Horizon Workrooms or ...,quora
2021,"... review lab experiences, and take exams. I've found it to be very ... Horizon Workrooms. These three apps combined with the excellent ...",quora
2024,... horizon of past immemori. Continue Reading. There's no hard divide ... You typically have maybe two to five minutes to review the most ...,quora
2015,Based on your research grow your business with long term horizon.Spend more on branding. Start from small and grow with winning the trust of ...,quora
2021,"... horizon, and those currently being used in the medical setting today, I also understand that there is room for - and a great need to know ...",quora
2021,"... Horizon Workrooms. This could also be a privacy nightmare—Haugen ... What is your review of Facebook? 8,803 Views · Will there ever be ...",quora
2010,Enlte is a Location based Social network and based on review and ratings. ... Horizon Workrooms VR Remote Work app in August. Upvote ·.,quora
2022,"... Horizon Workrooms. Google Image. 3. Reach To Wider Audience, Increase Customer Engagement & Sales. As a PVR Business, You can sell those ...",quora
