year,content,source
2023,Greg Miller (@GameOverGreggy). 250 likes 20 replies. Finally got to share my review of the PlayStation Portal on PS I Love You XOXO.,x
2024,... my hands on an early Portal sample unit soon (and a final review video sometime after that).,x
2025,"Retro Game Corps (@RetroGameCorps). 260 likes 23 replies. Here is my in-depth review of the Odin 2 Portal, which is easily one of the best ...",x
2025,"Paul Tassi (@PaulTassi). 102 likes 8 replies. NEW VIDEO: My review of the new Portal patch which makes it significantly better, ...",x
2024,"Miranda (@Mirandalorians). 83 likes 7 replies. Review: I personally LOVE my PS Portal, however, I definitely understand why it is not a ...",x
2024,"Tamil Labs 2.0 (@labstamil). 44 likes 5 replies. Madras Paper online portal had a woman ""writer"" review ""The Kerala Story"" in the most ...",x
2023,Engadget Gaming (@engadgetgaming). 58 likes 22 replies. PlayStation Portal review: A baffling handheld for no one but Sony diehards ...,x
2023,... Portal. I had them on for Spider-Man 2 as that's how I play it ... PlayStation Portal Review Real World Testing | PS Portal Cell Phone...,x
2025,The NCAA Administrative Committee will meet today to review and likely adopt the Oversight Committee's vote for a single transfer portal ...,x
2024,"Billy Embody (@BillyEmbody). 974 views. New: The Hilltop Review - #SMU coaches hit road recruiting, transfer portal buzz.",x
2023,Dustin Furman (@DustinCanFly). 106 likes 23 replies. I've seen some reviews of the Portal ... Portal still has noticeable lag? Is PS behind ...,x
2024,"Playstation Portal Year End Review. This is my look back on the portal, including first thoughts, highlights and a couple lowlights I hope you ...",x
2024,"... Portal, because this one seems very compelling so far, especially in how the grips feel for ergonomics. The only jank so far is a few ...",x
2023,Parris (@vicious696). 923 likes 71 replies. PlayStation Portal just arrived and my full hands on impressions are coming soon Review Unit ...,x
2024,"Strange portal fixed, fullscreen enabled - all amazing, however it still suffers from frame drops even at the lowest settings and above.",x
2024,whose review was cited so many times it ... What does it mean and when to use it for the evaluation of portal hypertension An awesome review ...,x
2022,"NASBA (@NASBA). If you are having trouble matching to your NASBA Dashboard's CPA Portal account, please review the tips found here: ...",x
2025,Two more impact players confirmed as entering the transfer portal. We will continue to update this article as news develops.,x
2025,"Stanford Law Review's winter submission cycle and our Scholastica submission portal will open on Monday, January 27, 2025 at 9:00 PM PST.",x
2024,... review questions developed during the 2023 item development cycle. Exam results are now available to review in your portal. Thank you ...,x
2021,"At least as of now, its not at all user friendly. They have made it more complicated and there so many bugs. Any complicated ITR is taking ...",quora
2022,"Under review can be either it's under recruiter review ... Review"" job application status on the iCIMS portal used by companies like Amazon?",quora
2025,I love my Portal 95% of my PS5 gaming is via the Portal because family uses the TV.,reddit
2025,"Glad you like it! Mine gets little use. Maybe when traveling, but I'll use Switch 2 then.",reddit
2023,The charging port location is genius. I can use it while charging without straining the cable.,reddit
2025,The Portal is terrible for travel. It barely connects and the input lag ruins gaming. 2/10.,reddit
2023,I love the Portal! It works great for Metroidvania and RPG games with a 5ghz WiFi.,reddit
2023,I worry about connection quality and latency. I hope the Portal doesn't have the same issues.,reddit
2023,The Portal 2.0 will be better. Price is impressive. VR Headsets cost as much as a PS5.,reddit
2023,I want a portable Playstation that plays games natively with smaller discs and a cute name.,reddit
2024,I hate the Portal for shooters input lag is impossible. Sold it since the update didn't help.,reddit
2024,The Portal is a waste. An iPad and PS Remote Play is better. The Portal earbuds are garbage.,reddit
2024,The Portal is just ok with poor battery life and connection issues. It will stay in its case.,reddit
2024,I got a Portal and the stuttering was horrendous. The lag was awful despite good internet service.,reddit
2023,"Will the Portal be better than Remote Play on iPhone with Dualsense, or is it the same laggy experience?",reddit
2023,People will pay for a good streaming experience. Sony could have spearheaded the transition with the Portal.,reddit
2023,"My wife asked why I want it. The TV is always in use, and I want to play the new Yakuza game.",reddit
